,output_text,vector,output_data_source,index
242,"بگشا در بیا درآ که مبا عیش بی شما	به حق چشم مست تو که تویی چشمه وفا
سخنم بسته می شود تو یکی زلف برگشا	انا و الشمس و الضحی تلف الحب و الولا
انا فی العشق آیه فاقرونی علی الملا	امه العشق فاعرجوا دونکم سلم الهوی
دیدمش مست می گذشت گفتم ای ماه تا کجا	گفت نی همچنین مکن همچنین در پیم بیا
در پیش چون روان شدم برگرفت تیز تیزپا	در پی گام تیز او چه محل باد و برق را
انا منذ رایتهم انا صرت بلا انا	صوره فی زجاجه نور الارض و السما
رکب القلب نوره فجلی القلب و اصطفی	کل من رام نوره استضا مثله استضا
کیف یلقاه غیره ک",[[0.00835557 0.00959208 0.0058813  ... 0.01068321 0.0046345  0.0270669 ]],غزلیات مولوی,243
243,"چه شدی گر تو همچون من شدییی عاشق ای فتا	همه روز اندر آن جنون همه شب اندر این بکا
ز دو چشمت خیال او نشدی یک دمی نهان	که دو صد نور می رسد به دو دیده از آن لقا
ز رفیقان گسستیی ز جهان دست شستیی	که مجرد شدم ز خود که مسلم شدم تو را
چو بر این خلق می تنم مثل آب و روغنم	ز برونیم متصل به درونه ز هم جدا
ز هوس ها گذشتیی به جنون بسته گشتیی	نه جنونی ز خلط و خون که طبیبش دهد دوا
که طبیبان اگر دمی بچشندی از این غمی	بجهندی ز بند خود بدرندی کتاب ها
هله زین جمله درگذر بطلب معدن شکر	که شوی محو آن شکر چو لبن در زلوب",[[0.00672341 0.01326058 0.00724002 ... 0.00535533 0.00853417 0.02627605]],غزلیات مولوی,244
244,"از برای صلاح مجنون را	بازخوان ای حکیم افسون را
از برای علاج بی خبری	درج کن در نبیذ افیون را
چون نداری خلاص بی چون شو	تا ببینی جمال بی چون را
دل پرخون ببین تو ای ساقی	درده آن جام لعل چون خون را
زانک عقل از برای مادونی	سجده آرد ز حرص هر دون را
باده خواران به نیم جو نخرند	این دو قرص درست گردون را
نخوت عشق را ز مجنون پرس	تا که در سر چهاست مجنون را
گمرهی های عشق بردرد	صد هزاران طریق و قانون را
ای صبا تو برو بگو از من	از کرم بحر در مکنون را
گر چه از خشم گفته ای نکنم	روح بخش این حماء مسنون را
شمس تبریز","[[ 0.00397875  0.00818168 -0.00033756 ...  0.00577384  0.00766681
   0.02474868]]",غزلیات مولوی,245
245,"صد دهل می زنند در دل ما	بانگ آن بشنویم ما فردا
پنبه در گوش و موی در چشمست	غم فردا و وسوسه سودا
آتش عشق زن در این پنبه	همچو حلاج و همچو اهل صفا
آتش و پنبه را چه می داری	این دو ضدند و ضد نکرد بقا
چون ملاقات عشق نزدیکست	خوش لقا شو برای روز لقا
مرگ ما شادی و ملاقاتست	گر تو را ماتمست رو زین جا
چونک زندان ماست این دنیا	عیش باشد خراب زندان ها
آنک زندان او چنین خوش بود	چون بود مجلس جهان آرا
تو وفا را مجو در این زندان	که در این جا وفا نکرد وفا","[[ 0.00355179  0.00809868  0.00314471 ...  0.01626626  0.01050782
  -0.00431154]]",غزلیات مولوی,246
246,"بانگ تسبیح بشنو از بالا	پس تو هم سبح اسمه الاعلی
گل و سنبل چرد دلت چون یافت	مرغزاری که اخرج المرعی
یعلم الجهر نقش این آهوست	ناف مشکین او و مایخفی
نفس آهوان او چو رسید	روح را سوی مرغزار هدی
تشنه را کی بود فراموشی	چون سنقرئک فلا تنسی","[[-7.1474678e-05  3.2367891e-05 -7.7693167e-06 ...  2.1561972e-04
  -9.7298442e-05  4.0939834e-04]]",غزلیات مولوی,247
247,"گوش من منتظر پیام تو را	جان به جان جسته یک سلام تو را
در دلم خون شوق می جوشد	منتظر بوی جوش جام تو را
ای ز شیرینی و دلاویزی	دانه حاجت نبوده دام تو را
کرده شاهان نثار تاج و کمر	مر قبای کمین غلام تو را
ز اول عشق من گمان بردم	که تصور کنم ختام تو را
سلسله ام کن به پای اشتر بند	من طمع کی کنم سنام تو را
آنک شیری ز لطف تو خوردست	مرگ بیند یقین فطام تو را
به حق آن زبان کاشف غیب	که به گوشم رسان پیام تو را
به حق آن سرای دولت بخش	بنمایم ز دور بام تو را
گر سر از سجده تو سود کند	چه زیانست لطف عام تو را
شمس تبر","[[-3.2137727e-05  3.8298145e-03  6.1806948e-03 ...  9.6444730e-03
   6.8714535e-03  2.0555679e-02]]",غزلیات مولوی,248
248,"دل بر ما شدست دلبر ما	گل ما بی حدست و شکر ما
ما همیشه میان گلشکریم	زان دل ما قویست در بر ما
زهره دارد حوادث طبعی	که بگردد بگرد لشکر ما
ما به پر می پریم سوی فلک	زانک عرشیست اصل جوهر ما
ساکنان فلک بخور کنند	از صفات خوش معنبر ما
همه نسرین و ارغوان و گلست	بر زمین شاهراه کشور ما
نه بخندد نه بشکفد عالم	بی نسیم دم منور ما
ذره های هوا پذیرد روح	از دم عشق روح پرور ما
گوش ها گشته اند محرم غیب	از زبان و دل سخنور ما
شمس تبریز ابرسوز شدست	سایه اش کم مباد از سر ما","[[ 1.33429945e-03 -1.44791065e-05  5.50764985e-03 ...  9.66529083e-03
   4.78170067e-03  2.70774327e-02]]",غزلیات مولوی,249
249,"هین که منم بر در در برگشا	بستن در نیست نشان رضا
در دل هر ذره تو را درگهیست	تا نگشایی بود آن در خفا
فالق اصباحی و رب الفلق	باز کنی صد در و گویی درآ
نی که منم بر در بلک توی	راه بده در بگشا خویش را
آمد کبریت بر آتشی	گفت برون آ بر من دلبرا
صورت من صورت تو نیست لیک	جمله توام صورت من چون غطا
صورت و معنی تو شوم چون رسی	محو شود صورت من در لقا
آتش گفتش که برون آمدم	از خود خود روی بپوشم چرا
هین بستان از من تبلیغ کن	بر همه اصحاب و همه اقربا
کوه اگر هست چو کاهش بکش	داده امت من صفت کهربا
کاه ربای من که می کش","[[ 6.4744512e-05  1.8076124e-04 -1.4871391e-04 ...  3.8000732e-04
  -2.4104380e-05  4.1461608e-04]]",غزلیات مولوی,250
250,"پیشتر آ پیشتر ای بوالوفا	از من و ما بگذر و زوتر بیا
پیشتر آ درگذر از ما و من	پیشتر آ تا نه تو باشی نه ما
کبر و تکبر بگذار و بگیر	در عوض کبر چنین کبریا
گفت الست و تو بگفتی بلی	شکر بلی چیست کشیدن بلا
سر بلی چیست که یعنی منم	حلقه زن درگه فقر و فنا
هم برو از جا و هم از جا مرو	جا ز کجا حضرت بی جا کجا
پاک شو از خویش و همه خاک شو	تا که ز خاک تو بروید گیا
ور چو گیا خشک شوی خوش بسوز	تا که ز سوز تو فروزد ضیا
ور شوی از سوز چو خاکستری	باشد خاکستر تو کیمیا
بنگر در غیب چه سان کیمیاست	کو ز کف خاک بسازد تو را
ا",[[0.00950106 0.00718176 0.00553717 ... 0.01672296 0.00712678 0.01646347]],غزلیات مولوی,251
251,"نذر کند یار که امشب تو را	خواب نباشد ز طمع برتر آ
حفظ دماغ آن مدمغ بود	چونک سهر باید یار مرا
هست دماغ تو چو زیت چراغ	هست چراغ تن ما بی وفا
گر دبه پرزیت بود سود نیست	صبح شود گشت چراغت فنا
دعوت خورشید به از زیت تو	چند چراغ ارزد آن یک صلا
چشم خوشش را ابدا خواب نیست	مست کند چشم همه خلق را
جمله بخسپند و تبسم کند	چشم خوشش بر خلل چشم ها
پس لمن الملک برآید به چرخ	کو ملکان خوش زرین قبا
کو امرا کو وزرا کو مهان	بهر بلادالله حافظ کجا
اهل علم چون شد و اهل قلم	دیو نیابی تو به دیوان سرا
خانه و تنشان شده تاریک ","[[9.6094434e-04 6.8665827e-03 4.6725799e-03 ... 4.9438025e-03
  2.2195081e-05 2.4014169e-02]]",غزلیات مولوی,252
252,"چند نهان داری آن خنده را	آن مه تابنده فرخنده را
بنده کند روی تو صد شاه را	شاه کند خنده تو بنده را
خنده بیاموز گل سرخ را	جلوه کن آن دولت پاینده را
بسته بدانست در آسمان	تا بکشد چون تو گشاینده را
دیده قطار شترهای مست	منتظرانند کشاننده را
زلف برافشان و در آن حلقه کش	حلق دو صد حلقه رباینده را
روز وصالست و صنم حاضرست	هیچ مپا مدت آینده را
عاشق زخمست دف سخت رو	میل لبست آن نی نالنده را
بر رخ دف چند طپانچه بزن	دم ده آن نای سگالنده را
ور به طمع ناله برآرد رباب	خوش بگشا آن کف بخشنده را
عیب مکن گر غزل ابتر ب","[[ 4.2234841e-03  1.0303009e-02  3.3333104e-03 ... -4.6583527e-06
  -6.9109787e-04  1.4816173e-02]]",غزلیات مولوی,253
253,"باده ده آن یار قدح باره را	یار ترش روی شکرپاره را
منگر آن سوی بدین سو گشا	غمزه غمازه خون خواره را
دست تو می مالد بیچاره وار	نه به کفش چاره بیچاره را
خیره و سرگشته و بی کار کن	این خرد پیر همه کاره را
ای کرمت شاه هزاران کرم	چشمه فرستی جگر خاره را
طفل دوروزه چو ز تو بو برد	می کشد او سوی تو گهواره را
ترک کند دایه و صد شیر را	ای بدل روغن کنجاره را
خوب کلیدی در بربسته را	خوب کمندی دل آواره را
کار تو این باشد ای آفتاب	نور فرستی مه و استاره را
منتظرش باش و چو مه نور گیر	ترک کن این گنگل و نظاره را
رحمت ت","[[-0.00057025  0.00051279  0.00171844 ...  0.00646135 -0.00057595
   0.02097717]]",غزلیات مولوی,254
254,"خیز صبوحی کن و درده صلا	خیز که صبح آمد و وقت دعا
کوزه پر از می کن و در کاسه ریز	خیز مزن خنبک و خم برگشا
دور بگردان و مرا ده نخست	جان مرا تازه کن ای جان فزا
خیز که از هر طرفی بانگ چنگ	در فلک انداخت ندا و صدا
تنتن تنتن شنو و تن مزن	وقت تو خوش ای قمر خوش لقا
در سرم افکن می و پابند کن	تا نروم بیهده از جا به جا

زان کف دریاصفت درنثار	آب درانداز چو کشتی مرا
پاره چوبی بدم و از کفت	گشته ام ای موسی جان اژدها
عازر وقتم به دمت ای مسیح	حشر شدم از تک گور فنا
یا چو درختم که به امر رسول	بیخ کشان آمدم اندر فلا
","[[ 1.6075139e-05  2.3569335e-05 -1.6136953e-05 ...  3.3193562e-04
  -4.9709713e-05 -4.8440331e-04]]",غزلیات مولوی,255
255,"داد دهی ساغر و پیمانه را	مایه دهی مجلس و میخانه را
مست کنی نرگس مخمور را	پیش کشی آن بت دردانه را
جز ز خداوندی تو کی رسد	صبر و قرار این دل دیوانه را
تیغ برآور هله ای آفتاب	نور ده این گوشه ویرانه را
قاف تویی مسکن سیمرغ را	شمع تویی جان چو پروانه را
چشمه حیوان بگشا هر طرف	نقل کن آن قصه و افسانه را
مست کن ای ساقی و در کار کش	این بدن کافر بیگانه را
گر نکند رام چنین دیو را	پس چه شد آن ساغر مردانه را
نیم دلی را به چه آرد که او	پست کند صد دل فرزانه را
از پگه امروز چه خوش مجلسیست	آن صنم و فتنه فتانه را
بش",[[0.00623747 0.00269549 0.00034809 ... 0.00659965 0.00357703 0.030169  ]],غزلیات مولوی,256
256,"لعل لبش داد کنون مر مرا	آنچ تو را لعل کند مر مرا
گلبن خندان به دل و جان بگفت	برگ منت هست به گلشن برآ
گر نخریدست جهان را ز غم	مژده چرا داد خدا کاشتری
در بن خانه ست جهان تنگ و منگ	زود برآیید به بام سرا
صورت اقبال شکرریز گفت	شکر چو کم نیست شکایت چرا
ساغر بر دست خرامان رسید	فخر من و فخر همه ماورا
جام مباح آمد هین نوش کن	با زره از غابر و از ماجرا
ساغر اول چو دود بر سرت	سجده کند عقل جنون تو را
فاش مکن فاش تو اسرار عرش	در سخنی زاده ز تحت الثری","[[-0.00016138  0.00848217  0.00290891 ...  0.00836267  0.00195736
   0.02072843]]",غزلیات مولوی,257
257,"گر بنخسبی شبی ای مه لقا	رو به تو بنماید گنج بقا
گرم شوی شب تو به خورشید غیب	چشم تو را باز کند توتیا
امشب استیزه کن و سر منه	تا که ببینی ز سعادت عطا
جلوه گه جمله بتان در شبست	نشنود آن کس که بخفت الصلا
موسی عمران نه به شب دید نور	سوی درختی که بگفتش بیا
رفت به شب بیش ز ده ساله راه	دید درختی همه غرق ضیا
نی که به شب احمد معراج رفت	برد براقیش به سوی سما
روز پی کسب و شب از بهر عشق	چشم بدی تا که نبیند تو را
خلق بخفتند ولی عاشقان	جمله شب قصه کنان با خدا
گفت به داوود خدای کریم	هر کی کند دعوی سودای ما
چون ","[[ 0.0006207   0.00498707  0.00446826 ...  0.00509625 -0.00027301
   0.01844594]]",غزلیات مولوی,258
258,"پیش کش آن شاه شکرخانه را	آن گهر روشن دردانه را
آن شه فرخ رخ بی مثل را	آن مه دریادل جانانه را
روح دهد مرده پوسیده را	مهر دهد سینه بیگانه را
دامن هر خار پر از گل کند	عقل دهد کله دیوانه را
در خرد طفل دوروزه نهد	آنچ نباشد دل فرزانه را
طفل کی باشد تو مگر منکری	عربده استن حنانه را
مست شوی و شه مستان شوی	چونک بگرداند پیمانه را

بیخودم و مست و پراکنده مغز	ور نه نکو گویم افسانه را
با همه بشنو که بباید شنود	قصه شیرین غریبانه را
بشکند آن روی دل ماه را	بشکند آن زلف دو صد شانه را
قصه آن چشم کی یارد گزارد	ساح",[[0.01656009 0.00775723 0.00572673 ... 0.00927784 0.00880481 0.02842721]],غزلیات مولوی,259
259,"چرخ فلک با همه کار و کیا	گرد خدا گردد چون آسیا
گرد چنین کعبه کن ای جان طواف	گرد چنین مایده گرد ای گدا
بر مثل گوی به میدانش گرد	چونک شدی سرخوش بی دست و پا
اسب و رخت راست بر این شه طواف	گر چه بر این نطع روی جا به جا
خاتم شاهیت در انگشت کرد	تا که شوی حاکم و فرمانروا
هر که به گرد دل آرد طواف	جان جهانی شود و دلربا
همره پروانه شود دلشده	گردد بر گرد سر شمع ها
زانک تنش خاکی و دل آتشی ست	میل سوی جنس بود جنس را
گرد فلک گردد هر اختری	زانک بود جنس صفا با صفا
گرد فنا گردد جان فقیر	بر مثل آهن و آهن ربا
زانک و",[[0.00431775 0.00157104 0.00346645 ... 0.01700035 0.00401112 0.02037708]],غزلیات مولوی,260
260,"هان ای طبیب عاشقان سوداییی دیدی چو ما	یا صاحبی اننی مستهلک لو لاکما
ای یوسف صد انجمن یعقوب دیدستی چو من	اصفر خدی من جوی و ابیض عینی من بکا
از چشم یعقوب صفی اشکی دوان بین یوسفی	تجری دموعی بالولا من مقلتی عین الولا
صد مصر و صد شکرستان درجست اندر یوسفان	الصید جل او صغر فالکل فی جوف الفرا
اسباب عشرت راست شد هر چه دلم می خواست شد	فالوقت سیف قاطع لا تفتکر فیما مضی
جان باز اندر عشق او چون سبط موسی را مگو	اذهب و ربک قاتلا انا قعودها هنا
هرگز نبینی در جهان مظلومتر زین عاشقان	قولوا لاصحاب الحجی رفقا باربا",[[0.00841163 0.00169326 0.00839216 ... 0.04819425 0.00629925 0.02767009]],غزلیات مولوی,261
261,"فیما تری فیما تری یا من یری و لا یری	العیش فی اکنافنا و الموت فی ارکاننا
ان تدننا طوبی لنا ان تحفنا یا ویلنا	یا نور ضو ناظرا یا خاطرا مخاطرا
ندعوک ربا حاضرا من قلبنا تفاخرا	فکن لنا فی ذلنا برا کریما غافرا
من می روم توکلی در این ره و در این سرا	اگر نواله ای رسد نیمی مرا نیمی تو را
خود کی رود کشتی در او که او تهی بیرون رود	کیل گهر همی رسد بر مشتری و مشترا
کیل گهر همی رسد قرص قمر همی رسد	نور بصر همی رسد اندکترین چیزها
خوش اندرآ در انجمن جز بر شکر لگد مزن	جز بر قرابی ها مزن جر بر بتان جان فزا",[[0.00254708 0.00364969 0.00870313 ... 0.00743874 0.00924692 0.01605909]],غزلیات مولوی,262
262,"به شکرخنده اگر می ببرد جان مرا	متع الله فوادی بحبیبی ابدا
جانم آن لحظه بخندد که ویش قبض کند	انما یوم اجزای اذا اسکرها
مغز هر ذره چو از روزن او مست شود	سبحت راقصه عز حبیبی و علا
چونک از خوردن باده همگی باده شوم	انا نقل و مدام فاشربانی و کلا
هله ای روز چه روزی تو که عمر تو دراز	یوم وصل و رحیق و نعیم و رضا
تن همچون خم ما را پی آن باده سرشت	نعم ما قدر ربی لفوادی و قضا
خم سرکه دگرست و خم دوشاب دگر	کان فی خابیه الروح نبیذ فغلی
چون بخسپد خم باده پی آن می جوشد	انما القهوه تغلی لشرور و دما
می منم خود که ","[[-1.2186445e-04  5.8442751e-05 -8.9779672e-07 ...  4.5079307e-04
  -1.8829773e-05  4.8850474e-05]]",غزلیات مولوی,263
263,"لی حبیب حبه یشوی الحشا	لو یشا یمشی علی عینی مشا
روز آن باشد که روزیم او بود	ای خوشا آن روز و روزی ای خوشا
آن چه باشد کو کند کان نیست خوش	قد رضینا یفعل الله ما یشا
خار او سرمایه گل ها بود	انه المنان فی کشف الغشا
هر چه گفتی یا شنیدی پوست بود	لیس لب العشق سرا قد فشا
کی به قشر پوست ها قانع شود	ذو لباب فی التجلی قد نشا
من خمش کردم غمش خامش نکرد	عافنا من شر واش قد وشا",[[0.00051791 0.00656385 0.00408114 ... 0.01726281 0.00065063 0.03031665]],غزلیات مولوی,264
264,"راح بفیها و الروح فیها	کم اشتهیها قم فاسقنیها
این راز یارست این ناز یارست	آواز یارست قم فاسقنیها
ادرکت ثاری قبلت جاری	فازداد ناری قم فاسقنیها
لب بوسه بر شد جفت شکر شد	خود تشنه تر شد قم فاسقنیها
الله واقی و السعد ساقی	نعم التلاقی قم فاسقنیها
هر چند یارم گیرد کنارم	من بی قرارم قم فاسقنیها
ساقی مواسی یسخوا بکاسی	یحلف براسی قم فاسقنیها
در گوش من باد خوش مژده ای داد	زان سرو آزاد قم فاسقنیها
کاسا اداری عقل السکاری	منهم تواری قم فاسقنیها
می گفت من خوش وی گفت می چش	ما در کشاکش قم فاسقنیها",[[0.00695366 0.00693856 0.00828883 ... 0.0592312  0.00471475 0.00624023]],غزلیات مولوی,265
265,"هیج نومی و نفی ریح علی الغور هفا	اذکرنی و امضه طیب زمان سلفا
یا رشا الحاظه صیرن روحی هدفا	یا قمرا الفاظه اورثن قلبی شرفا
شوقنی ذوقنی ادرکنی اضحکنی	افقرنی اشکرنی صاحب جود و علا
اذا حدا طیبنی و ان بدا غیبنی	و ان نای شیبنی لا زال یوم الملتقی
اکرم بحبی سامیا اضحی لصید رامیا	حتی رمی باسهم فیهن سقمی و شفا
یا قمر الطوارق تاجا علی المفارق	لاح من المشارق بدل لیلتی ضحی
لاح مفاز حسن یفتح عنها الوسن	یا ثقتی لا تهنوا و اعتجلوا مغتنما
یا نظری صل لما غمضت عنه النظرا	اغضبه فاستترا عاد الی ما لا یری
کن دنفا مقتر",[[0.00594671 0.0027332  0.00825789 ... 0.02828311 0.00501963 0.02404458]],غزلیات مولوی,266
266,"قد اشرقت الدنیا من نور حمیانا	البدر غدا ساقی و الکاس ثریانا
الصبوه ایمانی و الخلوه بستانی	و المشجر ندمانی و الورد محیانا
من کان له عشق فالمجلس مثواه	من کان له عقل ایاه و ایانا
من ضاق به دار او اعطشه نار	تهدیه الی عین یسترجع ریانا
من لیس له عین یستبصر عن غیب	فلیات علی شوق فی خدمه مولانا
یا دهر سوی صدر شمس الحق تبریز	هل ابصر فی الدنیا انسانک انسانا
طوبی لک یا مهدی قد ذبت من الجهد	اعرضت عن الصوره کی تدرک معنانا
من کان له هم یفنیه و یردیه	فلیشرب و لیسکر من قهوه مولانا","[[ 0.0002782   0.00282859  0.00064138 ...  0.00790931 -0.00090308
   0.01787378]]",غزلیات مولوی,267
267,"فدیتک یا ذا الوحی آیاته تتری	تفسرها سرا و تکنی به جهرا
و انشرت امواتا و احییتهم بها	فدیتک ما ادریک بالامر ما ادری
فعادوا سکاری فی صفاتک کلهم	و ما طعموا ثما و لا شربوا خمرا
ولکن بریق القرب افنی عقولهم	فسبحان من ارسی و سبحان من اسری
سلام علی قوم تنادی قلوبهم	بالسنه الاسرار شکرا له شکرا
فطوبی لمن ادلی من الجد دلوه	و فی الدلو حسنا یوسف قال یا بشری
یطالع فی شعشاع و جنه یوسف	حقائق اسرار یحیط بها خبرا
تجلی علیه الغیب و اندک عقله	کما اندک ذاک الطور و استهدم الصخرا
فظل غریق العشق روحا مجسما	و نورا عظیما ","[[-1.5746432e-04  3.0538089e-05 -1.7254284e-05 ...  6.9567171e-04
  -3.4140729e-05  1.5298223e-04]]",غزلیات مولوی,268
