,output_text,vector,output_data_source,index
386,"خاک آن کس شو که آب زندگانش روشنست	نیم نانی دررسد تا نیم جانی در تنست
گفتمش آخر پی یک وصل چندین هجر چیست	گفت آری من قصابم گردران با گردنست
دی تماشا رفته بودم جانب صحرای دل	آن نگنجد در نظر چه جای پیدا کردنست
چشم مست یار گویان هر زمان با چشم من	در دو عالم می نگنجد آنچ در چشم منست
رو فزون شو از دو عالم تا بریزم بر سرت	آنچ دل را جان جان و دیدگان را دیدنست
ذره ذره عاشقانه پهلوی معشوق خویش	می زند پهلو که وقت عقد و کابین کردنست
اندر آن پیوند کردن آب و آتش یک شده ست	غنچه آن جا سنبلست و سرو آن جا سوسنست
ز",[[0.00553502 0.00240439 0.00495869 ... 0.00448944 0.00535989 0.02828647]],غزلیات مولوی,387
387,"خدمت بی دوستی را قدر و قیمت هست نیست	خدمت اندر دست هست و دوستی در دست نیست
دوستی در اندرون خود خدمتی پیوسته است	هیچ خدمت جز محبت در جهان پیوست نیست
ور تو مستی می نمایی در محبت چون نه ای	عشق گوید دوغ خورد و دوغ خورد او مست نیست
پست و بالا چند یازد از تکلف در هوا	چند خود را پست دارد آن کسی کو پست نیست
همچو ماهی مانده در دام جهان زان بحر دور	وانگهان پنداشته خود را که اندر شست نیست","[[ 6.0409717e-03 -7.0012993e-06  7.8936089e-03 ...  9.3336701e-03
   9.9327704e-03  2.2667238e-02]]",غزلیات مولوی,388
388,"چون دلت با من نباشد همنشینی سود نیست	گر چه با من می نشینی چون چنینی سود نیست
چون دهانت بسته باشد در جگر آتش بود	در میان جو درآیی آب بینی سود نیست
چونک در تن جان نباشد صورتش را ذوق نیست	چون نباشد نان و نعمت صحن و سینی سود نیست
گر زمین از مشک و عنبر پر شود تا آسمان	چون نباشد آدمی را راه بینی سود نیست
تا ز آتش می گریزی ترش و خامی چون پنیر	گر هزاران یار و دلبر می گزینی سود نیست","[[-6.1443840e-05  3.2852247e-04 -1.2621553e-06 ... -6.4372654e-07
  -2.4002915e-05 -2.2409831e-05]]",غزلیات مولوی,389
389,"ساربانا اشتران بین سر به سر قطار مست	میر مست و خواجه مست و یار مست اغیار مست
باغبانا رعد مطرب ابر ساقی گشت و شد	باغ مست و راغ مست و غنچه مست و خار مست
آسمانا چند گردی گردش عنصر ببین	آب مست و باد مست و خاک مست و نار مست
حال صورت این چنین و حال معنی خود مپرس	روح مست و عقل مست و خاک مست اسرار مست
رو تو جباری رها کن خاک شو تا بنگری	ذره ذره خاک را از خالق جبار مست
تا نگویی در زمستان باغ را مستی نماند	مدتی پنهان شدست از دیده مکار مست
بیخ های آن درختان می نهانی می خورند	روزکی دو صبر می کن تا شود بیدار ","[[ 2.6399437e-05 -1.9851230e-08 -7.3750707e-06 ... -4.0802915e-05
  -4.5842608e-05 -4.0840835e-04]]",غزلیات مولوی,390
390,"مطربا این پرده زن کان یار ما مست آمدست	وان حیات باصفای باوفا مست آمدست
گر لباس قهر پوشد چون شرر بشناسمش	کو بدین شیوه بر ما بارها مست آمدست
آب ما را گر بریزد ور سبو را بشکند	ای برادر دم مزن کاین دم سقا مست آمدست
می فریبم مست خود را او تبسم می کند	کاین سلیم القلب را بین کز کجا مست آمدست
آن کسی را می فریبی کز کمینه حرف او	آب و آتش بیخود و خاک و هوا مست آمدست
گفتمش گر من بمیرم تو رسی بر گور من	برجهم از گور خود کان خوش لقا مست آمدست
گفت آن کاین دم پذیرد کی بمیرد جان او	با خدا باقی بود آن کز خدا مست آ","[[ 0.00028746  0.00959208  0.01193056 ...  0.00639622 -0.00099087
   0.01833759]]",غزلیات مولوی,391
391,"گر ندید آن شادجان این گلستان را شاد چیست	گر نه لطف او بود پس عیش را بنیاد چیست
گر خرابات ازل از تاب رویش پر نگشت	پس هزاران صومعه در محو جان آباد چیست
جان ما با عشق او گر نی ز یک جا رسته اند	جان بااقبال ما با عشق او همزاد چیست
گر نه پرتوهای آن رخسار داد حسن داد	پس به دیوان سرای عاشقان بیداد چیست
ساکنان آب و گل گر عشق ما را محرمند	پس درون گنبد دل غلغله و فریاد چیست
گر نه آتش می زند آتش رخی در جان نهان	پس دماغ عاشقان پرآتش و پرباد چیست
گر نه آتش رنگ گشتی جان ها در لامکان	صد هزاران مشعله همچون شب می","[[-3.5476369e-05  5.5370457e-03  2.2481715e-03 ...  1.0092887e-02
   4.7042975e-03  1.6117968e-02]]",غزلیات مولوی,392
392,"جمع باشید ای حریفان زانک وقت خواب نیست	هر حریفی کو بخسبد والله از اصحاب نیست
روی بستان را نبیند راه بستان گم کند	هر که او گردان و نالان شیوه دولاب نیست
ای بجسته کام دل اندر جهان آب و گل	می دوانی سوی آن جو کاندر آن جو آب نیست
ز آسمان دل برآ ماها و شب را روز کن	تا نگوید شب روی کامشب شب مهتاب نیست
بی خبر بادا دل من از مکان و کان او	گر دلم لرزان ز عشقش چون دل سیماب نیست","[[ 1.6896889e-06  2.7661757e-05 -5.7001639e-06 ...  2.3433284e-04
  -1.8969711e-05 -7.7245531e-05]]",غزلیات مولوی,393
393,"چشمه ای خواهم که از وی جمله را افزایش است	دلبری خواهم که از وی مرده را آسایش است
بنده بحر محیطم کز محیطی برتر است	سنگ و گوهر هر دو را از فضل او بخشایش است
باغ و طاووسند هر یک از جمالش بانصیب	زاغ را خالی ندارد گر چه بی آرایش است
صورت ار نقصان پذیرد نیست معنی را کمی	عاشق اندر ذوق باشد گر چه در پالایش است
بنگر اندر جان که هست او از بلندی بی خبر	گر چه اندر قالب او در خانه آلایش است
شمس تبریزی قدومت خانه اقبال را	صحن را افروزش است و بام را اندایش است","[[ 1.0873669e-02 -1.8395127e-05  1.7659703e-03 ...  1.2387280e-02
   1.1126901e-02  3.3926502e-02]]",غزلیات مولوی,394
394,"عشق اندر فضل و علم و دفتر و اوراق نیست	هر چه گفت و گوی خلق آن ره ره عشاق نیست
شاخ عشق اندر ازل دان بیخ عشق اندر ابد	این شجر را تکیه بر عرش و ثری و ساق نیست
عقل را معزول کردیم و هوا را حد زدیم	کاین جلالت لایق این عقل و این اخلاق نیست
تا تو مشتاقی بدان کاین اشتیاق تو بتی است	چون شدی معشوق از آن پس هستیی مشتاق نیست
مرد بحری دایما بر تخته خوف و رجا است	چونک تخته و مرد فانی شد جز استغراق نیست
شمس تبریزی تویی دریا و هم گوهر تویی	زانک بود تو سراسر جز سر خلاق نیست","[[ 1.8533999e-03 -1.6646818e-05  2.9253063e-03 ...  6.8556224e-03
   1.4132194e-02  2.3274649e-02]]",غزلیات مولوی,395
395,"در ره معشوق ما ترسندگان را کار نیست	جمله شاهانند آن جا بندگان را بار نیست
گر تو نازی می کنی یعنی که من فرخنده ام	نزد این اقبال ما فرخندگی جز عار نیست
گر به فقرت ناز باشد ژنده برگیر و برو	نزد این سلطان ما آن جمله جز زنار نیست
گر تو نور حق شدی از شرق تا مغرب برو	زانک ما را زین صفت پروای آن انوار نیست
گر تو سر حق بدانستی برو با سر باش	زانک این اسرار ما را خوی آن اسرار نیست
راست شو در راه ما وین مکر را یک سوی نه	زان که این میدان ما جولانگه مکار نیست
شمس دین و شمس دین آن جان ما اینک بدان	جز به سوی را","[[ 1.5091484e-04  1.9690548e-05 -6.2677793e-07 ...  1.4184780e-03
  -1.8587149e-05  9.4111238e-05]]",غزلیات مولوی,396
396,"آفتاب امروز بر شکل دگر تابان شدست	در شعاعش همچو ذره جان من رقصان شدست
مشتری در طالع است و ماه و زهره در حضور	یار چوگان زلف مه رو میر این میدان شدست
هر قدح کز می دهد گوید بگیر و هوش دار	هش که دارد عقل دارد عقل خود پنهان شدست
بزم سلطان است این جا هر که سلطانی است نوش	خوان رحمت گسترید و ساقی اخوان شدست
ساقیا پایان رسیدی عشق را از سر بگیر	پا چه باشد سر چه باشد پا و سر یک سر شدست","[[ 1.8801354e-03 -2.0697165e-05  6.2256474e-03 ...  8.4277568e-03
   7.3672732e-04  1.9185316e-02]]",غزلیات مولوی,397
397,"از سقاهم ربهم بین جمله ابرار مست	وز جمال لایزالی هفت و پنج و چار مست
این قیامت بین که گویی آشکارا شد ز غیب	خم و کوزه حوض کوثر از می جبار مست
تن چو سایه بر زمین و جان پاک عاشقان	در بهشت عشق تجری تحتها الانهار مست
چون فزون گردد تجلی از جمال حق ببین	ذره ذره هر دو عالم گشته موسی وار مست
از تقاضاهای مستان وز جواب لن تران	در شفاعت مو به موی احمد مختار مست
او سر است و ما چو دستار اندر او پیچیده ایم	از شراب آن سری گردد سر و دستار مست
یوسف مصری فروکن سر به مصر اندرنگر	شهر پرآشوب بین و جمله بازار مست
گر ب",[[0.00855815 0.00778176 0.02006392 ... 0.03163693 0.00256493 0.01923715]],غزلیات مولوی,398
398,"آخر ای دلبر نه وقت عشرت انگیزی شدست	آخر ای کان شکر وقت شکرریزی شدست
تو چو آب زندگانی ما چو دانه زیر خاک	وقت آن کز لطف خود با ما درآمیزی شدست
گر بپوسم همچو دانه عاقبت نخلی شوم	زانک جمله چیزها چیزی ز بی چیزی شدست
زین سپس با من مکن تیزی تو ای شمشیر حق	زانک از لطف تو ز آتش تندی و تیزی شدست
جان کشیدم پیش عشقش گفت کو چیزی دگر	گفتم آخر جان جان زین سان ز بی چیزی شدست
چون حجاب چشم دل شد چشم صورت لاجرم	شمس تبریزی حجاب شمس تبریزی شدست",[[0.00727934 0.00162191 0.00588885 ... 0.01678318 0.00666426 0.01892406]],غزلیات مولوی,399
399,"چون نظر کردن همه اوصاف خوب اندر دلست	وین همه اوصاف رسوا معدنش آب و گلست
از هوا و شهوت ای جان آب و گل می صد شود	مشکل این ترک هوا و کاشف هر مشکلست
وین تعلل بهر ترکش دافع صد علتست	چون بشد علت ز تو پس نقل منزل منزلست
لیک شرطی کن تو با خود تا که شرطی نشکنی	ور نه علت باقی و درمانت محو و زایلست
چونک طبعت خو کند با شرط تندش بعد از آن	صد هزاران حاصل جان از درونت حاصلست
پس تو را آیینه گردد این دل آهن چنانک	هر دمی رویی نماید روی آن کو کاهلست
پس تو را مطرب شود در عیش و هم ساقی شود	آن امانت چونک شد محمول جان","[[ 0.00922187  0.04546389  0.00836282 ... -0.00047483  0.00995769
   0.02689977]]",غزلیات مولوی,400
400,"اندرآ ای مه که بی تو ماه را استاره نیست	تا خیالت درنیاید پای کوبان چاره نیست
چون خیالت بر که آید چشمه ها گردد روان	خود گرفتم کاین دل ما جز که و جز خاره نیست
آتش از سنگی روان شد آب از سنگی دگر	لعل شد سنگی دگر کز لطف تو آواره نیست
بارها لطف تو را من آزمودم ای لطیف	مرده را تو زنده کردی بارها یک باره نیست
ابر رحمت هر سحر گر می ببارد آن ز تست	وین دل گریان من جز کودک گهواره نیست
همچو کوه طور از غم این دلم صدپاره شد	لیک اندر دست من زان پاره ها یک پاره نیست
آهن برهان موسی بر دل چون سنگ زد	تا جهد استاره ",[[0.00821784 0.0090021  0.00939264 ... 0.00939295 0.00287144 0.01691246]],غزلیات مولوی,401
401,"نقش بند جان که جان ها جانب او مایلست	عاقلان را بر زبان و عاشقان را در دلست
آنک باشد بر زبان ها لا احب الافلین	باقیات الصالحات است آنک در دل حاصلست
دل مثال آسمان آمد زبان همچون زمین	از زمین تا آسمان ها منزل بس مشکلست
دل مثال ابر آمد سینه ها چون بام ها	وین زبان چون ناودان باران از این جا نازلست
آب از دل پاک آمد تا به بام سینه ها	سینه چون آلوده باشد این سخن ها باطلست
این خود آن کس را بود کز ابر او باران چکد	بام کو از ابر گیرد ناودانش قایلست
آنک برد از ناودان دیگران او سارقست	آنک دزدد آب بام دیگران ","[[ 1.2241421e-02 -2.7212036e-05  7.6256655e-03 ...  6.1696162e-03
   2.8197861e-03  3.1265859e-02]]",غزلیات مولوی,402
402,"گر تو پنداری به حسن تو نگاری هست نیست	ور تو پنداری مرا بی تو قراری هست نیست
ور تو گویی چرخ می گردد به کار نیک و بد	چرخ را جز خدمت خاک تو کاری هست نیست
سال ها شد که بیرون درت چون حلقه ایم	بر در تو حلقه بودن هیچ عاری هست نیست
بر در اندیشه ترسان گشته ایم از هر خیال	خواجه را این جا خیالی هست آری هست نیست
ای دل جاسوس من در پیش کیکاووس من	جز صلاح الدین ز دل ها هوشیاری هست نیست",[[0.00489443 0.03309783 0.00253348 ... 0.00837888 0.00973369 0.02469001]],غزلیات مولوی,403
403,"هله ای آنک بخوردی سحری باده که نوشت	هله پیش آ که بگویم سخن راز به گوشت
می روح آمد نادر رو از آن هم بچش آخر	که به یک جرعه بپرد همه طراری و هوشت
چو از این هوش برستی به مساقات و به مستی	دهدت صد هش دیگر کرم باده فروشت
چو در اسرار درآیی کندت روح سقایی	به فلک غلغله افتد ز هیاهوی و خروشت
بستان باده دیگر جز از آن احمر و اصفر	کندت خواجه معنی برهاند ز نقوشت
دهد آن کان ملاحت قدحی وقت صباحت	به از آن صد قدح می که بخوردی شب دوشت
تو اگرهای نگویی و اگر هوی نگویی	همه اموات و جمادات بجوشند ز جوشت
چو در آن حلقه بگ",[[0.01788339 0.00029539 0.00575803 ... 0.00333198 0.0109777  0.03014494]],غزلیات مولوی,404
404,"به خدا کت نگذارم که روی راه سلامت	که سر و پا و سلامت نبود روز قیامت
حشم عشق درآمد ربض شهر برآمد	هله ای یار قلندر بشنو طبل ملامت
دل و جان فانی لا کن تن خود همچو قبا کن	نه اثر گو نه خبر گو نه نشانی نه علامت
چو من از خویش برستم ره اندیشه ببستم	هله ای سرده مستم برهانم به تمامت
هله برجه هله برجه قدمی بر سر خود نه	هله برپر هله برپر چو من از شکر و غرامت
ببر ای عشق چو موسی سر فرعون تکبر	هله فرعون به پیش آ که گرفتم در و بامت
چو من از غیب رسیدم سپه غیب کشیدم	برو ای ظالم سرکش که فتادی ز زعامت
هله پالیز تو ","[[-9.1679125e-05  3.7935760e-03  1.4385296e-03 ...  8.3942171e-03
  -2.7678165e-04  2.1125225e-02]]",غزلیات مولوی,405
405,"چند گویی که چه چاره ست و مرا درمان چیست	چاره جوینده که کرده ست تو را خود آن چیست
چند باشد غم آنت که ز غم جان ببرم	خود نباشد هوس آنک بدانی جان چیست
بوی نانی که رسیده ست بر آن بوی برو	تا همان بوی دهد شرح تو را کاین نان چیست
گر تو عاشق شده ای عشق تو برهان تو بس	ور تو عاشق نشدی پس طلب برهان چیست
این قدر عقل نداری که ببینی آخر	گر نه شاهیست پس این بارگه سلطان چیست
گر نه اندر تتق ازرق زیباروییست	در کف روح چنین مشعله تابان چیست
چونک از دور دلت همچو زنان می لرزد	تو چه دانی که در آن جنگ دل مردان چیست
آتش ",[[0.00897111 0.02015613 0.0143832  ... 0.00696243 0.01010789 0.02663692]],غزلیات مولوی,406
406,"چشم پرنور که مست نظر جانانست	ماه از او چشم گرفتست و فلک لرزانست
خاصه آن لحظه که از حضرت حق نور کشد	سجده گاه ملک و قبله هر انسانست
هر که او سر ننهد بر کف پایش آن دم	بهر ناموس منی آن نفس او شیطانست
و آنک آن لحظه نبیند اثر نور برو	او کم از دیو بود زانک تن بی جانست
دل به جا دار در آن طلعت باهیبت او	گر تو مردی که رخش قبله گه مردانست
دست بردار ز سینه چه نگه می داری	جان در آن لحظه بده شاد که مقصود آنست
جمله را آب درانداز و در آن آتش شو	کآتش چهره او چشمه گه حیوانست
سر برآور ز میان دل شمس تبریز	کو خدیو ا","[[ 1.8744184e-02 -2.2721666e-05  3.3020710e-03 ...  1.2319248e-02
   3.0813501e-03  2.5594199e-02]]",غزلیات مولوی,407
407,"آن شنیدی که خضر تخته کشتی بشکست	تا که کشتی ز کف ظالم جبار برست
خضر وقت تو عشق است که صوفی ز شکست	صافیست و مثل درد به پستی بنشست
لذت فقر چو باده ست که پستی جوید	که همه عاشق سجده ست و تواضع سرمست
تا بدانی که تکبر همه از بی مزگیست	پس سزای متکبر سر بی ذوق بس است
گریه شمع همه شب نه که از درد سرست	چون ز سر رست همه نور شد از گریه برست
کف هستی ز سر خم مدمغ برود	چون بگیرد قدح باده جان بر کف دست
ماهیا هر چه تو را کام دل از بحر بجو	طمع خام مکن تا نخلد کام ز شست
بحر می غرد و می گوید کای امت آب	راست گویید بر","[[-6.7746063e-05  4.3018283e-03  1.0569346e-02 ...  1.4223557e-02
   1.8832963e-02  2.6826832e-02]]",غزلیات مولوی,408
408,"تا نلغزی که ز خون راه پس و پیش ترست	آدمی دزد ز زردزد کنون بیشترست
گربزانند که از عقل و خبر می دزدند	خود چه دارند کسی را که ز خود بی خبرست
خود خود را تو چنین کاسد و بی خصم مدان	که جهان طالب زر و خود تو کان زرست
که رسول حق الناس معادن گفته ست	معدن نقره و زرست و یقین پرگهرست
گنج یابی و در او عمر نیابی تو به گنج	خویش دریاب که این گنج ز تو بر گذرست
خویش دریاب و حذر کن تو ولیکن چه کنی	که یکی دزد سبک دست در این ره حذرست
سحر ار چند که تاریست حساب روزست	هر که را روی سوی شمس بود چون سحرست
روح ها مست شود ا","[[-9.6330179e-05  1.0659819e-04 -3.0506287e-06 ...  5.6887307e-04
  -3.6591136e-05 -1.5507046e-04]]",غزلیات مولوی,409
409,"دوش آمد بر من آنک شب افروز منست	آمدن باری اگر در دو جهان آمدنست
آنک سرسبزی خاک ست و گهربخش فلک	چاشنی بخش وطن هاست اگر بی وطنست
در کف عقل نهد شمع که بستان و بیا	تا در من که شفاخانه هر ممتحن است
شمع را تو گرو این لگن تن چه کنی	این لگن گر نبود شمع تو را صد لگنست
تا در این آب و گلی کار کلوخ اندازیست	گفت و گو جمله کلوخ ست و یقین دل شکنست
گوهر آینه جان همه در ساده دلی ست	میل تو بهر تصدر همه در فضل و فن است
زین گذر کن صفت یار شکربخش بگو	که ز عشوه شکرش ذره به ذره دهن است
خیره گشته است صفت ها همه کان چه ","[[ 4.6125553e-03 -4.0035593e-05  1.1195000e-02 ...  1.1530761e-02
   1.0239973e-02  2.6645398e-02]]",غزلیات مولوی,410
410,"عجب ای ساقی جان مطرب ما را چه شدست	هله چون می نزند ره ره او را کی زدست
او ز هر نیک و بد خلق چرا می لنگد	بد و نیک همه را نعره مطرب مدد است
دف دریدست طرب را به خدا بی دف او	مجلس یارکده بی دم او بارکدست
شهر غلبیرگهی دان که شود زیر و زبر	دست غلبیرزنش سخره صاحب بلدست
خیره کم گوی خمش مطرب مسکین چه کند	این همه فتنه آن فتنه گر خوب خدست","[[-1.6762197e-05  1.4178708e-04 -3.6604342e-05 ...  1.4274854e-03
  -7.7572397e-05  2.8878069e-03]]",غزلیات مولوی,411
411,"آنک بی باده کند جان مرا مست کجاست	و آنک بیرون کند از جان و دلم دست کجاست
و آنک سوگند خورم جز به سر او نخورم	و آنک سوگند من و توبه ام اشکست کجاست
و آنک جان ها به سحر نعره زنانند از او	و آنک ما را غمش از جای ببرده ست کجاست
جان جان ست وگر جای ندارد چه عجب	این که جا می طلبد در تن ما هست کجاست
غمزه چشم بهانه ست و زان سو هوسی ست	و آنک او در پس غمزه ست دل خست کجاست
پرده روشن دل بست و خیالات نمود	و آنک در پرده چنین پرده دل بست کجاست
عقل تا مست نشد چون و چرا پست نشد	و آنک او مست شد از چون و چرا رست کجاست","[[-1.24536309e-04 -3.70237245e-08 -1.56821479e-05 ...  6.76358759e-04
  -1.91268628e-05  1.37613415e-05]]",غزلیات مولوی,412
412,"من نشستم ز طلب وین دل پیچان ننشست	همه رفتند و نشستند و دمی جان ننشست
هر کی استاد به کاری بنشست آخر کار	کار آن دارد آن کز طلب آن ننشست
هر کی او نعره تسبیح جماد تو شنید	تا نبردش به سراپرده سبحان ننشست
تا سلیمان به جهان مهر هوایت ننمود	بر سر اوج هوا تخت سلیمان ننشست
هر کی تشویش سر زلف پریشان تو دید	تا ابد از دل او فکر پریشان ننشست
هر کی در خواب خیال لب خندان تو دید	خواب از او رفت و خیال لب خندان ننشست
ترشی های تو صفرای رهی را ننشاند	وز علاج سر سودای فراوان ننشست
هر که را بوی گلستان وصال تو رسید	همچ","[[ 4.2572003e-04 -3.9115839e-06 -1.3792416e-04 ...  7.2335155e-04
  -2.9632902e-05 -5.2206754e-04]]",غزلیات مولوی,413
