,output_text,vector,output_data_source,index
106,"امیر حسن خندان کن چشم را	وجودی بخش مر مشتی عدم را
سیاهی می نماید لشکر غم	ظفر ده شادی صاحب علم را
به حسن خود تو شادی را بکن شاد	غم و اندوه ده اندوه و غم را
کرم را شادمان کن از جمالت	که حسن تو دهد صد جان کرم را
تو کارم زان بر سیمین چو زر کن	تو لعلین کن رخ همچون زرم را
دلا چون طالب بیشی عشقی	تو کم اندیش در دل بیش و کم را
بنه آن سر به پیش شمس تبریز	که ایمانست سجده آن صنم را",[[0.00146908 0.00273979 0.0064585  ... 0.01843341 0.01475209 0.01587645]],غزلیات مولوی,107
107,"به برج دل رسیدی بیست این جا	چو آن مه را بدیدی بیست این جا
بسی این رخت خود را هر نواحی	ز نادانی کشیدی بیست این جا
بشد عمری و از خوبی آن مه	به هر نوعی شنیدی بیست این جا
ببین آن حسن را کز دیدن او	بدید و نابدیدی بیست این جا
به سینه تو که آن پستان شیرست	که از شیرش چشیدی بیست این جا","[[ 0.01676868  0.00090808  0.00301191 ... -0.00018915  0.00188658
   0.02008759]]",غزلیات مولوی,108
108,"بکت عینی غداه البین دمعا	و اخری بالبکا بخلت علینا
فعاقبت التی بخلت علینا	بان غمضتها یوم التقینا
چه مرد آن عتابم خیز یارا	بده آن جام مالامال صهبا
نرنجم ز آنچ مردم می برنجند	که پیشم جمله جان ها هست یکتا
اگر چه پوستینی بازگونه	بپوشیدست این اجسام بر ما
تو را در پوستین من می شناسم	همان جان منی در پوست جانا
بدرم پوست را تو هم بدران	چرا سازیم با خود جنگ و هیجا
یکی جانیم در اجسام مفرق	اگر خردیم اگر پیریم و برنا
چراغک هاست کآتش را جدا کرد	یکی اصلست ایشان را و منش
یکی طبع و یکی رنگ و یکی خوی	که سرهاشان نب",[[0.01876995 0.00143624 0.00366941 ... 0.00831499 0.00325044 0.03288881]],غزلیات مولوی,109
109,"تو بشکن چنگ ما را ای معلا	هزاران چنگ دیگر هست این جا
چو ما در چنگ عشق اندرفتادیم	چه کم آید بر ما چنگ و سرنا
رباب و چنگ عالم گر بسوزد	بسی چنگی پنهانیست یارا
ترنگ و تنتنش رفته به گردون	اگر چه ناید آن در گوش صما
چراغ و شمع عالم گر بمیرد	چو غم چون سنگ و آهن هست برجا
به روی بحر خاشاکست اغانی	نیاید گوهری بر روی دریا
ولیکن لطف خاشاک از گهر دان	که عکس عکس برق اوست بر ما
اغانی جمله فرع شوق وصلیست	برابر نیست فرع و اصل اصلا
دهان بربند و بگشا روزن دل	از آن ره باش با ارواح گویا",[[0.01987339 0.00570235 0.01068417 ... 0.00799794 0.00414822 0.02303188]],غزلیات مولوی,110
110,"برای تو فدا کردیم جان ها	کشیده بهر تو زخم زبان ها
شنیده طعنه های همچو آتش	رسیده تیر کاری زان کمان ها
اگر دل را برون آریم پیشت	ببخشایی بر آن پرخون نشان ها
اگر دشمن تو را از من بدی گفت	مها دشمن چه گوید جز چنان ها
بیا ای آفتاب جمله خوبان	که در لطف تو خندد لعل کان ها
که بی تو سود ما جمله زیانست	که گردد سود با بودت زیان ها
گمان او بسستش زهر قاتل	که در قند تو دارد بدگمان ها",[[0.00341613 0.00557062 0.00824878 ... 0.01328108 0.00989514 0.02489253]],غزلیات مولوی,111
111,"ز روی تست عید آثار ما را	بیا ای عید و عیدی آر ما را
تو جان عید و از روی تو جانا	هزاران عید در اسرار ما را
چو ما در نیستی سر درکشیدیم	نگیرد غصه دستار ما را
چو ما بر خویشتن اغیار گشتیم	نباشد غصه اغیار ما را
شما را اطلس و شعر خیالی	خیال خوب آن دلدار ما را
کتاب مکر و عیاری شما را	عتاب دلبر عیار ما را
شما را عید در سالی دو بارست	دو صد عیدست هر دم کار ما را
شما را سیم و زر بادا فراوان	جمال خالق جبار ما را
شما را اسب تازی باد بی حد	براق احمد مختار ما را
اگر عالم همه عیدست و عشرت	برو عالم شما را یار ما ","[[-2.2433624e-04  6.5819586e-06 -2.3241662e-06 ...  7.8830664e-04
  -1.9030331e-05  1.3638893e-04]]",غزلیات مولوی,112
112,"ای مطرب دل برای یاری را	در پرده زیر گوی زاری را
رو در چمن و به روی گل بنگر	همدم شو بلبل بهاری را
دانی چه حیات ها و مستی هاست	در مجلس عشق جان سپاری را
چون دولت بی شمار را دیدی	بسپار بدو دم شماری را
ای روح شکار دلبری گشتی	کو زنده کند ابد شکاری را
ای ساقی دل ز کار واماندم	وقتست بده شراب کاری را
آراسته کن مرا و مجلس را	کآراسته ای شرابداری را
بزمیست نهان چنین حریفان را	جا نیست دگر شرابخواری را","[[ 5.0429241e-03 -6.7511119e-06  4.6486591e-04 ...  1.6908515e-02
   1.0192007e-03  2.3227716e-02]]",غزلیات مولوی,113
113,"اندر دل ما تویی نگارا	غیر تو کلوخ و سنگ خارا
هر عاشق شاهدی گزیدست	ما جز تو ندیده ایم یارا
گر غیر تو ماه باشد ای جان	بر غیر تو نیست رشک ما را
ای خلق حدیث او مگویید	باقی همه شاهدان شما را
بر نقش فنا چه عشق بازد	آن کس که بدید کبریا را
بر غیر خدا حسد نیارد	آن کس که گمان برد خدا را
گر رشک و حسد بری برو بر	کین رشک بدست انبیا را
چون رفت بر آسمان چارم	عیسی چه کند کلیسیا را
بوبکر و عمر به جان گزیدند	عثمان و علی مرتضا را
شمس تبریز جو روان کن	گردان کن سنگ آسیا را","[[ 4.6638488e-03 -2.6065342e-08 -6.5372387e-06 ...  9.1404369e-04
  -2.4916058e-05 -1.6287189e-05]]",غزلیات مولوی,114
114,"ای جان و قوام جمله جان ها	پر بخش و روان کن روان ها
با تو ز زیان چه باک داریم	ای سودکن همه زیان ها
فریاد ز تیرهای غمزه	وز ابروهای چون کمان ها
در لعل بتان شکر نهادی	بگشاده به طمع آن دهان ها
ای داده به دست ما کلیدی	بگشاده بدان در جهان ها
گر زانک نه در میان مایی	برجسته چراست این میان ها
ور نیست شراب بی نشانیت	پس شاهد چیست این نشان ها
ور تو ز گمان ما برونی	پس زنده ز کیست این گمان ها
ور تو ز جهان ما نهانی	پیدا ز کی می شود نهان ها
بگذار فسانه های دنیا	بیزار شدیم ما از آن ها
جانی که فتاد در شکرریز	کی گن",[[0.00135695 0.00209021 0.0039445  ... 0.01511414 0.00198579 0.03628802]],غزلیات مولوی,115
115,"ای سخت گرفته جادوی را	شیری بنموده آهوی را
از سحر تو احولست دیده	در دیده نهاده ای دوی را
بنموده ای از ترنج آلو	کی یافت ترنج آلوی را
سحر تو نمود بره را گرگ	بنموده ز گندمی جوی را
منشور بقا نموده سحرت	طومار خیال منطوی را
پر باد هدایتست ریشش	از سحر تو جاهل غوی را
سوفسطاییم کرد سحرت	ای ترک نموده هندوی را
چون پشه نموده وقت پیکار	پیلان تهمتن قوی را
تا جنگ کنند و راست آرند	تقدیر و قضای مستوی را
سوفسطایی مشو خمش کن	بگشای زبان معنوی را","[[ 3.5609745e-03 -1.4536312e-05  3.8446693e-03 ...  3.9387667e-03
   4.4144709e-03  3.3053461e-02]]",غزلیات مولوی,116
116,"از دور بدیده شمس دین را	فخر تبریز و رشک چین را
آن چشم و چراغ آسمان را	آن زنده کننده زمین را
ای گشته چنان و آن چنانتر	هر جان که بدیده او چنین را
گفتا که که را کشم به زاری	گفتمش که بنده کمین را
این گفتن بود و ناگهانی	از غیب گشاد او کمین را
آتش درزد به هست بنده	وز بیخ بکند کبر و کین را
بی دل سیهی لاله زان می	سرمست بکرد یاسمین را
در دامن اوست عین مقصود	بر ما بفشاند آستین را
شاهی که چو رخ نمود مه را	بر اسب فلک نهاد زین را
بنشین کژ و راست گو که نبود	همتا شه روح راستین را
والله که از او خبر نباشد	جبریل","[[-6.52408517e-06  1.73649676e-06 -1.57664897e-06 ...  4.92733554e-04
  -1.26617615e-05 -5.39605608e-05]]",غزلیات مولوی,117
117,"بنمود وفا از این جا	هرگز نرویم ما از این جا
این جا مدد حیات جانست	ذوقست دو چشم را از این جا
این جاست که پا به گل فرورفت	چون برگیریم پا از این جا
این جا به خدا که دل نهادیم	کس را مبر ای خدا از این جا
این جاست که مرگ ره ندارد	مرگست بدن جدا از این جا
زین جای برآمدی چو خورشید	روشن کردی مرا از این جا
جان خرم و شاد و تازه گردد	زین جا یابد بقا از این جا
یک بار دگر حجاب بردار	یک بار دگر برآ از این جا
این جاست شراب لایزالی	درریز تو ساقیا از این جا
این چشمه آب زندگانیست	مشکی پر کن سقا از این جا
این جا پر ","[[ 0.00187483  0.00696475  0.00124949 ...  0.00934504 -0.00116637
   0.01839921]]",غزلیات مولوی,118
118,"برخیز و صبوح را بیارا	پرلخلخه کن کنار ما را
پیش آر شراب رنگ آمیز	ای ساقی خوب خوب سیما
از من پرسید کو چه ساقیست	قندست و هزار رطل حلوا
آن ساغر پرعقار برریز	بر وسوسه محال پیما
آن می که چو صعوه زو بنوشد	آهنگ کند به صید عنقا
زان پیش که دررسد گرانی	برجه سبک و میان ما آ
می گرد و چو ماه نور می ده	حمرا می ده بدان حمیرا
ما را همه مست و کف زنان کن	وان گاه نظاره کن تماشا
در گردش و شیوه های مستان	در عربده های در علالا
در گردن این فکنده آن دست	کان شاه من و حبیب و مولا
او نیز ببرده روی چون گل	می بوسد یار را کف","[[ 3.2141830e-05  5.7202054e-05 -1.1566330e-05 ...  2.4149365e-04
  -4.3718548e-05 -2.8545706e-04]]",غزلیات مولوی,119
119,"تا چند تو پس روی به پیش آ	در کفر مرو به سوی کیش آ
در نیش تو نوش بین به نیش آ	آخر تو به اصل اصل خویش آ
هر چند به صورت از زمینی	پس رشته گوهر یقینی
بر مخزن نور حق امینی	آخر تو به اصل اصل خویش آ
خود را چو به بیخودی ببستی	می دانک تو از خودی برستی
وز بند هزار دام جستی	آخر تو به اصل اصل خویش آ
از پشت خلیفه ای بزادی	چشمی به جهان دون گشادی
آوه که بدین قدر تو شادی	آخر تو به اصل اصل خویش آ
هر چند طلسم این جهانی	در باطن خویشتن تو کانی
بگشای دو دیده نهانی	آخر تو به اصل اصل خویش آ
چون زاده پرتو جلالی	وز طالع ","[[-1.5140428e-04  4.9730737e-05 -3.7445483e-05 ...  6.6426612e-04
  -2.5685078e-05  7.0150645e-04]]",غزلیات مولوی,120
120,"چون خانه روی ز خانه ما	با آتش و با زبانه ما
با رستم زال تا نگویی	از رخش و ز تازیانه ما
زیرا جز صادقان ندانند	مکر و دغل و بهانه ما
اندر دل هیچ کس نگنجیم	چون در سر اوست شانه ما
هر جا پر تیر او ببینی	آن جاست یقین نشانه ما
از عشق بگو که عشق دامست	زنهار مگو ز دانه ما
با خاطر خویش تا نگویی	ای محرم دل فسانه ما
گر تو به چنینه ای بگویی	والله که تویی چنانه ما
اندر تبریز بد فلانی	اقبال دل فلانه ما","[[ 3.1445082e-04  2.2112195e-04 -3.6294787e-05 ...  2.1519971e-03
  -8.2133018e-05  2.2564249e-04]]",غزلیات مولوی,121
121,"دیدم رخ خوب گلشنی را	آن چشم و چراغ روشنی را
آن قبله و سجده گاه جان را	آن عشرت و جای ایمنی را
دل گفت که جان سپارم آن جا	بگذارم هستی و منی را
جان هم به سماع اندرآمد	آغاز نهاد کف زنی را
عقل آمد و گفت من چه گویم	این بخت و سعادت سنی را
این بوی گلی که کرد چون سرو	هر پشت دوتای منحنی را
در عشق بدل شود همه چیز	ترکی سازند ارمنی را
ای جان تو به جان جان رسیدی	وی تن بگذاشتی تنی را
یاقوت زکات دوست ما راست	درویش خورد زر غنی را
آن مریم دردمند یابد	تازه رطب تر جنی را
تا دیده غیر برنیفتد	منمای به خلق محسنی را
ز ا","[[ 2.3823900e-03 -8.1487578e-06  1.9963696e-03 ...  3.7524344e-03
  -1.1242597e-03  2.1464935e-02]]",غزلیات مولوی,122
122,"دیدم شه خوب خوش لقا را	آن چشم و چراغ سینه ها را
آن مونس و غمگسار دل را	آن جان و جهان جان فزا را
آن کس که خرد دهد خرد را	آن کس که صفا دهد صفا را
آن سجده گه مه و فلک را	آن قبله جان اولیا را
هر پاره من جدا همی گفت	کای شکر و سپاس مر خدا را
موسی چو بدید ناگهانی	از سوی درخت آن ضیا را
گفتا که ز جست و جوی رستم	چون یافتم این چنین عطا را
گفت ای موسی سفر رها کن	وز دست بیفکن آن عصا را
آن دم موسی ز دل برون کرد	همسایه و خویش و آشنا را
اخلع نعلیک این بود این	کز هر دو جهان ببر ولا را
در خانه دل جز او نگنجد	دل د","[[ 9.6417563e-05 -7.1769747e-08 -4.4765379e-06 ...  1.1860464e-03
  -2.2056453e-05 -1.0705087e-04]]",غزلیات مولوی,123
123,"ساقی تو شراب لامکان را	آن نام و نشان بی نشان را
بفزا که فزایش روانی	سرمست و روانه کن روان را
یک بار دگر بیا درآموز	ساقی گشتن تو ساقیان را
چون چشمه بجوش از دل سنگ	بشکن تو سبوی جسم و جان را
عشرت ده عاشقان می را	حسرت ده طالبان نان را
نان معماریست حبس تن را	می بارانیست باغ جان را
بستم سر سفره زمین را	بگشا سر خم آسمان را
بربند دو چشم عیب بین را	بگشای دو چشم غیب دان را
تا مسجد و بتکده نماند	تا نشناسیم این و آن را

خاموش که آن جهان خاموش	در بانگ درآرد این جهان را","[[ 5.9998481e-05  8.3309351e-06 -1.4894320e-06 ...  1.6508531e-04
  -2.4412628e-05 -8.2266757e-05]]",غزلیات مولوی,124
124,"گفتی که گزیده ای تو بر ما	هرگز نبدست این مفرما
حاجت بنگر مگیر حجت	بر نقد بزن مگو که فردا
بگذار مرا که خوش بخسپم	در سایه ات ای درخت خرما
ای عشق تو در دلم سرشته	چون قند و شکر درون حلوا
وی صورت تو درون چشمم	مانند گهر میان دریا
داری سر ما سری بجنبان	تو نیز بگو زهی تماشا
آن وعده که کرده ای مرا دوش	کو زهره که تا کنم تقاضا
گر دست نمی رسد به خورشید	از دور همی کنم تمنا
خورشید و هزار همچو خورشید	در حسرت تست ای معلا","[[-3.6224667e-06 -2.4487306e-08 -6.9669759e-06 ...  1.5853609e-04
  -3.0503670e-05 -1.3805297e-04]]",غزلیات مولوی,125
125,"گستاخ مکن تو ناکسان را	در چشم میار این خسان را
درزی دزدی چو یافت فرصت	کم آرد جامه رسان را
ایشان را دار حلقه بر در	هم نیز نیند لایق آن را
پیشت به فسون و سخره آیند	از طمع مپوش این عیان را
ایشان چو ز خویش پرغمانند	چون دور کنند ز تو غمان را
جز خلوت عشق نیست درمان	رنج باریک اندهان را
یا دیدن دوست یا هوایش	دیگر چه کند کسی جهان را
تا دیدن دوست در خیالش	می دار تو در سجود جان را
پیشش چو چراغپایه می ایست	چون فرصت هاست مر مهان را
وامانده از این زمانه باشی	کی بینی اصل این زمان را
چون گشت گذار از مکان چشم	زو","[[-1.18297095e-04 -4.44963888e-08 -8.52111498e-06 ... -1.05967029e-05
  -1.51518243e-05 -9.44505973e-06]]",غزلیات مولوی,126
126,"کو مطرب عشق چست دانا	کز عشق زند نه از تقاضا
مردم به امید و این ندیدم	در گور شدم بدین تمنا
ای یار عزیز اگر تو دیدی	طوبی لک یا حبیب طوبی
ور پنهانست او خضروار	تنها به کناره های دریا
ای باد سلام ما بدو بر	کاندر دل ما از اوست غوغا
دانم که سلام های سوزان	آرد به حبیب عاشقان را
عشقیست دوار چرخ نه از آب	عشقیست مسیر ماه نه از پا
در ذکر به گردش اندرآید	با آب دو دیده چرخ جان ها
ذکرست کمند وصل محبوب	خاموش که جوش کرد سودا",[[0.00420799 0.00644008 0.00884766 ... 0.01168285 0.00369202 0.01429214]],غزلیات مولوی,127
127,"ما را سفری فتاد بی ما	آن جا دل ما گشاد بی ما
آن مه که ز ما نهان همی شد	رخ بر رخ ما نهاد بی ما
چون در غم دوست جان بدادیم	ما را غم او بزاد بی ما
ماییم همیشه مست بی می	ماییم همیشه شاد بی ما
ما را مکنید یاد هرگز	ما خود هستیم یاد بی ما
بی ما شده ایم شاد گوییم	ای ما که همیشه باد بی ما
درها همه بسته بود بر ما	بگشود چو راه داد بی ما
با ما دل کیقباد بنده ست	بنده ست چو کیقباد بی ما
ماییم ز نیک و بد رهیده	از طاعت و از فساد بی ما","[[-1.0221708e-04  7.2511966e-06 -7.0569183e-07 ...  3.1294867e-06
  -1.4543984e-05 -7.7734934e-05]]",غزلیات مولوی,128
128,"مشکن دل مرد مشتری را	بگذار ره ستمگری را
رحم آر مها که در شریعت	قربان نکنند لاغری را
مخمور توام به دست من ده	آن جام شراب گوهری را
پندی بده و به صلح آور	آن چشم خمار عبهری را
فرمای به هندوان جادو	کز حد نبرند ساحری را
در شش دره ای فتاد عاشق	بشکن در حبس شش دری را
یک لحظه معزمانه پیش آ	جمع آور حلقه پری را
سر می نهد این خمار از بن	هر لحظه شراب آن سری را
صد جا چو قلم میان ببسته	تنگ شکر معسکری را
ای عشق برادرانه پیش آ	بگذار سلام سرسری را
ای ساقی روح از در حق	مگذار حق برادری را
ای نوح زمانه هین روان کن	ای",[[0.00456199 0.00013322 0.0008032  ... 0.01578129 0.00716428 0.02233257]],غزلیات مولوی,129
129,"بیدار کنید مستیان را	از بهر نبیذ همچو جان را
ای ساقی باده بقایی	از خم قدیم گیر آن را
بر راه گلو گذر ندارد	لیکن بگشاید او زبان را
جان را تو چو مشک ساز ساقی	آن جان شریف غیب دان را
پس جانب آن صبوحیان کش	آن مشک سبک دل گران را
وز ساغرهای چشم مستت	درده تو فلان بن فلان را
از دیده به دیده باده ای ده	تا خود نشود خبر دهان را
زیرا ساقی چنان گذارد	اندر مجلس می نهان را
بشتاب که چشم ذره ذره	جویا گشتست آن عیان را
آن نافه مشک را به دست آر	بشکاف تو ناف آسمان را
زیرا غلبات بوی آن مشک	صبری بنهشت یوسفان را
چون نامه","[[-1.5157896e-04  1.1919146e-05 -3.5760218e-05 ...  3.9118470e-04
  -2.0460573e-05  9.6426747e-06]]",غزلیات مولوی,130
130,"من چو موسی در زمان آتش شوق و لقا	سوی کوه طور رفتم حبذا لی حبذا
دیدم آن جا پادشاهی خسروی جان پروری	دلربایی جان فزایی بس لطیف و خوش لقا
کوه طور و دشت و صحرا از فروغ نور او	چون بهشت جاودانی گشته از فر و ضیا
ساقیان سیمبر را جام زرین ها به کف	رویشان چون ماه تابان پیش آن سلطان ما
روی های زعفران را از جمالش تاب ها	چشم های محرمان را از غبارش توتیا
از نوای عشق او آن جا زمین در جوش بود	وز هوای وصل او در چرخ دایم شد سما
در فنا چون بنگرید آن شاه شاهان یک نظر	پای همت را فنا بنهاد بر فرق بقا
مطرب آن جا پرده ه",[[0.00177732 0.00570679 0.00486145 ... 0.01789763 0.005769   0.02585044]],غزلیات مولوی,131
131,"در میان پرده خون عشق را گلزارها	عاشقان را با جمال عشق بی چون کارها
عقل گوید شش جهت حدست و بیرون راه نیست	عشق گوید راه هست و رفته ام من بارها
عقل بازاری بدید و تاجری آغاز کرد	عشق دیده زان سوی بازار او بازارها
ای بسا منصور پنهان ز اعتماد جان عشق	ترک منبرها بگفته برشده بر دارها
عاشقان دردکش را در درونه ذوق ها	عاقلان تیره دل را در درون انکارها
عقل گوید پا منه کاندر فنا جز خار نیست	عشق گوید عقل را کاندر توست آن خارها
هین خمش کن خار هستی را ز پای دل بکن	تا ببینی در درون خویشتن گلزارها
شمس تبریزی تویی ",[[0.0086749  0.0143739  0.00541797 ... 0.00155792 0.00596981 0.02559229]],غزلیات مولوی,132
132,"غمزه عشقت بدان آرد یکی محتاج را	کو به یک جو برنسنجد هیچ صاحب تاج را
اطلس و دیباج بافد عاشق از خون جگر	تا کشد در پای معشوق اطلس و دیباج را
در دل عاشق کجا یابی غم هر دو جهان	پیش مکی قدر کی باشد امیر حاج را
عشق معراجیست سوی بام سلطان جمال	از رخ عاشق فروخوان قصه معراج را
زندگی ز آویختن دارد چو میوه از درخت	زان همی بینی درآویزان دو صد حلاج را
گر نه علم حال فوق قال بودی کی بدی	بنده احبار بخارا خواجه نساج را
بلمه ای هان تا نگیری ریش کوسه در نبرد	هندوی ترکی میاموز آن ملک تمغاج را
همچو فرزین کژروست و رخ ","[[ 1.3275504e-03 -4.3928816e-05  7.4431077e-03 ...  3.0710438e-02
   7.3013096e-03  2.4614388e-02]]",غزلیات مولوی,133
