,output_text,vector,output_data_source,index
0,"ای رستخیز ناگهان، وی رحمت بی منتها	ای آتشی افروخته، در بیشه ی اندیشه ها
امروز خندان آمدی، مفتاح زندان آمدی	بر مستمندان آمدی، چون بخشش و فضل خدا
خورشید را حاجب تویی، اومید را واجب تویی	مطلب تویی طالب تویی، هم منتها هم مبتدا
در سینه ها برخاسته، اندیشه را آراسته	هم خویش حاجت خواسته، هم خویشتن کرده روا
ای روح بخش بی بَدَل، وی لذت علم و عمل	باقی بهانه ست و دغل، کاین علت آمد وآن دوا
ما زان دغل کژ بین شده، با بی گنه در کین شده	گه مست حورالعین شده، گه مست نان و شوربا
این سُکر بین هل عقل را، وین نقل بین ","[[-2.0170630e-05 -4.1015923e-07 -1.8121667e-05 ...  1.2995041e-03
  -3.0223338e-05 -8.8606030e-05]]",غزلیات مولوی,1
1,"ای طایران قدس را عشقت فزوده بال ها	در حلقه سودای تو روحانیان را حال ها
در ""لا احب الافلین""، پاکی ز صورت ها یقین	در دیده های غیب بین، هر دم ز تو تمثال ها
افلاک از تو سرنگون، خاک از تو چون دریای خون	ماهت نخوانم، ای فزون از ماه ها و سال ها
کوه از غمت بشکافته، وآن غم به دل درتافته	یک قطره خونی یافته، از فضلت این افضال ها
ای سروران را تو سند، بشمار ما را زان عدد	دانی سران را هم بود، اندر تبع دنبال ها
سازی ز خاکی سیدی، بر وی فرشته حاسدی	با نقد تو جان کاسدی، پامال گشته مال ها
آن کو تو باشی بال او، ای ر",[[0.00811476 0.00055842 0.00309808 ... 0.02004682 0.00424029 0.02345594]],غزلیات مولوی,2
2,"ای دل چه اندیشیده ای در عذر آن تقصیرها	زان سوی او چندان وفا زین سوی تو چندین جفا
زان سوی او چندان کرم زین سو خلاف و بیش و کم	زان سوی او چندان نعم زین سوی تو چندین خطا
زین سوی تو چندین حسد چندین خیال و ظن بد	زان سوی او چندان کشش چندان چشش چندان عطا
چندین چشش از بهر چه تا جان تلخت خوش شود	چندین کشش از بهر چه تا دررسی در اولیا
از بد پشیمان می شوی الله گویان می شوی	آن دم تو را او می کشد تا وارهاند مر تو را
از جرم ترسان می شوی وز چاره پرسان می شوی	آن لحظه ترساننده را با خود نمی بینی چرا
گر چشم تو برب","[[-1.18002405e-04 -2.80360202e-09 -1.71756130e-06 ...  3.33802134e-04
  -1.95197044e-05  4.08270251e-04]]",غزلیات مولوی,3
3,"ای یوسف خوش نام ما خوش می روی بر بام ما	ای درشکسته جام ما ای بردریده دام ما
ای نور ما ای سور ما ای دولت منصور ما	جوشی بنه در شور ما تا می شود انگور ما
ای دلبر و مقصود ما ای قبله و معبود ما	آتش زدی در عود ما نظاره کن در دود ما
ای یار ما عیار ما دام دل خمار ما	پا وامکش از کار ما بستان گرو دستار ما
در گل بمانده پای دل جان می دهم چه جای دل	وز آتش سودای دل ای وای دل ای وای ما","[[ 9.6382581e-05 -8.2485601e-09 -8.0357967e-07 ...  7.1485818e-04
  -1.7676033e-05  1.0143357e-04]]",غزلیات مولوی,4
4,"آن شکل بین وان شیوه بین وان قد و خد و دست و پا	آن رنگ بین وان هنگ بین وان ماه بدر اندر قبا
از سرو گویم یا چمن از لاله گویم یا سمن	از شمع گویم یا لگن یا رقص گل پیش صبا
ای عشق چون آتشکده در نقش و صورت آمده	بر کاروان دل زده یک دم امان ده یا فتی
در آتش و در سوز من شب می برم تا روز من	ای فرخ پیروز من از روی آن شمس الضحی
بر گرد ماهش می تنم بی لب سلامش می کنم	خود را زمین برمی زنم زان پیش کو گوید صلا
گلزار و باغ عالمی چشم و چراغ عالمی	هم درد و داغ عالمی چون پا نهی اندر جفا
آیم کنم جان را گرو گویی مده زح","[[ 0.00421871  0.00388542  0.00597659 ...  0.00366418 -0.0009841
   0.01388797]]",غزلیات مولوی,5
5,"بگریز ای میر اجل از ننگ ما از ننگ ما	زیرا نمی دانی شدن همرنگ ما همرنگ ما
از حمله های جند او وز زخم های تند او	سالم نماند یک رگت بر چنگ ما بر چنگ ما
اول شرابی درکشی سرمست گردی از خوشی	بیخود شوی آنگه کنی آهنگ ما آهنگ ما
زین باده می خواهی برو اول تنک چون شیشه شو	چون شیشه گشتی برشکن بر سنگ ما بر سنگ ما
هر کان می احمر خورد بابرگ گردد برخورد	از دل فراخی ها برد دلتنگ ما دلتنگ ما
بس جره ها در جو زند بس بربط شش تو زند	بس با شهان پهلو زند سرهنگ ما سرهنگ ما
ماده است مریخ زمن این جا در این خنجر زدن	با مقنعه",[[0.00014211 0.0079155  0.00815927 ... 0.00651356 0.00446515 0.02118858]],غزلیات مولوی,6
6,"بنشسته ام من بر درت تا بوک برجوشد وفا	باشد که بگشایی دری گویی که برخیز اندرآ
غرقست جانم بر درت در بوی مشک و عنبرت	ای صد هزاران مرحمت بر روی خوبت دایما
ماییم مست و سرگران فارغ ز کار دیگران	عالم اگر برهم رود عشق تو را بادا بقا
عشق تو کف برهم زند صد عالم دیگر کند	صد قرن نو پیدا شود بیرون ز افلاک و خل
ای عشق خندان همچو گل وی خوش نظر چون عقل کل	خورشید را درکش به جل ای شهسوار هل اتی
امروز ما مهمان تو مست رخ خندان تو	چون نام رویت می برم دل می رود والله ز جا
کو بام غیر بام تو کو نام غیر نام تو	کو جام غی",[[0.02260914 0.00061541 0.01301197 ... 0.0064     0.00623523 0.0275081 ]],غزلیات مولوی,7
7,"جز وی چه باشد کز اجل اندررباید کل ما	صد جان برافشانم بر او گویم هنییا مرحبا
رقصان سوی گردون شوم زان جا سوی بی چون شوم	صبر و قرارم برده ای ای میزبان زودتر بیا
از مه ستاره می بری تو پاره پاره می بری	گه شیرخواره می بری گه می کشانی دایه را
دارم دلی همچون جهان تا می کشد کوه گران	من که کشم که کی کشم زین کاهدان واخر مرا
گر موی من چون شیر شد از شوق مردن پیر شد	من آردم گندم نیم چون آمدم در آسیا
در آسیا گندم رود کز سنبله زادست او	زاده مهم نی سنبله در آسیا باشم چرا
نی نی فتد در آسیا هم نور مه از روزنی	زان ",[[0.01024424 0.01447203 0.01003922 ... 0.02584518 0.00500816 0.01110272]],غزلیات مولوی,8
8,"من از کجا پند از کجا باده بگردان ساقیا	آن جام جان افزای را برریز بر جان ساقیا
بر دست من نه جام جان ای دستگیر عاشقان	دور از لب بیگانگان پیش آر پنهان ساقیا
نانی بده نان خواره را آن طامع بیچاره را	آن عاشق نانباره را کنجی بخسبان ساقیا
ای جان جان جان جان ما نامدیم از بهر نان	برجه گدارویی مکن در بزم سلطان ساقیا
اول بگیر آن جام مه بر کفه آن پیر نه	چون مست گردد پیر ده رو سوی مستان ساقیا
رو سخت کن ای مرتجا مست از کجا شرم از کجا	ور شرم داری یک قدح بر شرم افشان ساقیا
برخیز ای ساقی بیا ای دشمن شرم و حیا	تا ",[[0.01293798 0.01134072 0.00982233 ... 0.0246564  0.01092232 0.01352926]],غزلیات مولوی,9
9,"مهمان شاهم هر شبی بر خوان احسان و وفا	مهمان صاحب دولتم که دولتش پاینده با
بر خوان شیران یک شبی بوزینه ای همراه شد	استیزه رو گر نیستی او از کجا شیر از کجا
بنگر که از شمشیر شه در قهرمان خون می چکد	آخر چه گستاخی است این والله خطا والله خطا
گر طفل شیری پنجه زد بر روی مادر ناگهان	تو دشمن خود نیستی بر وی منه تو پنجه را
آن کو ز شیران شیر خورد او شیر باشد نیست مرد	بسیار نقش آدمی دیدم که بود آن اژدها
نوح ار چه مردم وار بد طوفان مردم خوار بد	گر هست آتش ذره ای آن ذره دارد شعله ها
شمشیرم و خون ریز من هم نرم","[[ 3.9728968e-03  7.1750306e-05 -8.2655309e-04 ...  7.2804047e-03
   1.2410911e-03  1.3479694e-02]]",غزلیات مولوی,10
10,"ای طوطی عیسی نفس وی بلبل شیرین نوا	هین زهره را کالیوه کن زان نغمه های جان فزا
دعوی خوبی کن بیا تا صد عدو و آشنا	با چهره ای چون زعفران با چشم تر آید گوا
غم جمله را نالان کند تا مرد و زن افغان کند	که داد ده ما را ز غم کو گشت در ظلم اژدها
غم را بدرانی شکم با دورباش زیر و بم	تا غلغل افتد در عدم از عدل تو ای خوش صدا
ساقی تو ما را یاد کن صد خیک را پرباد کن	ارواح را فرهاد کن در عشق آن شیرین لقا
چون تو سرافیل دلی زنده کن آب و گلی	دردم ز راه مقبلی در گوش ما نفخه خدا
ما همچو خرمن ریخته گندم به کاه آمیخته	",[[0.00792934 0.00080044 0.00060669 ... 0.02479823 0.00861608 0.01773391]],غزلیات مولوی,11
11,"ای نوبهار عاشقان داری خبر از یار ما	ای از تو آبستن چمن و ای از تو خندان باغ ها
ای بادهای خوش نفس عشاق را فریادرس	ای پاکتر از جان و جا آخر کجا بودی کجا
ای فتنه روم و حبش حیران شدم کاین بوی خوش	پیراهن یوسف بود یا خود روان مصطفی
ای جویبار راستی از جوی یار ماستی	بر سینه ها سیناستی بر جان هایی جان فزا
ای قیل و ای قال تو خوش و ای جمله اشکال تو خوش	ماه تو خوش سال تو خوش ای سال و مه چاکر تو را","[[ 1.1846043e-04 -3.2871757e-08 -9.5600581e-06 ...  1.0064627e-03
  -3.4276862e-05 -1.2653723e-04]]",غزلیات مولوی,12
12,"ای باد بی آرام ما با گل بگو پیغام ما	کای گل گریز اندر شکر چون گشتی از گلشن جدا
ای گل ز اصل شکری تو با شکر لایقتری	شکر خوش و گل هم خوش و از هر دو شیرینتر وفا
رخ بر رخ شکر بنه لذت بگیر و بو بده	در دولت شکر بجه از تلخی جور فنا
اکنون که گشتی گلشکر قوت دلی نور نظر	از گل برآ بر دل گذر آن از کجا این از کجا
با خار بودی همنشین چون عقل با جانی قرین	بر آسمان رو از زمین منزل به منزل تا لقا
در سر خلقان می روی در راه پنهان می روی	بستان به بستان می روی آن جا که خیزد نقش ها
ای گل تو مرغ نادری برعکس مرغان می پری","[[ 9.97728016e-03 -1.40311995e-05  1.30529469e-02 ...  4.28332342e-03
   5.47306379e-03  2.88282745e-02]]",غزلیات مولوی,13
13,"ای عاشقان ای عاشقان امروز ماییم و شما	افتاده در غرقابه ای تا خود که داند آشنا
گر سیل عالم پر شود هر موج چون اشتر شود	مرغان آبی را چه غم تا غم خورد مرغ هوا
ما رخ ز شکر افروخته با موج و بحر آموخته	زان سان که ماهی را بود دریا و طوفان جان فزا
ای شیخ ما را فوطه ده وی آب ما را غوطه ده	ای موسی عمران بیا بر آب دریا زن عصا
این باد اندر هر سری سودای دیگر می پزد	سودای آن ساقی مرا باقی همه آن شما
دیروز مستان را به ره بربود آن ساقی کله	امروز می در می دهد تا برکند از ما قبا
ای رشک ماه و مشتری با ما و پنهان چو","[[ 0.00070747  0.00084538  0.00090537 ...  0.00366851 -0.00095354
   0.01030788]]",غزلیات مولوی,14
14,"ای نوش کرده نیش را بی خویش کن باخویش را	باخویش کن بی خویش را چیزی بده درویش را
تشریف ده عشاق را پرنور کن آفاق را	بر زهر زن تریاق را چیزی بده درویش را
با روی همچون ماه خود با لطف مسکین خواه خود	ما را تو کن همراه خود چیزی بده درویش را
چون جلوه مه می کنی وز عشق آگه می کنی	با ما چه همره می کنی چیزی بده درویش را
درویش را چه بود نشان جان و زبان درفشان	نی دلق صدپاره کشان چیزی بده درویش را
هم آدم و آن دم تویی هم عیسی و مریم تویی	هم راز و هم محرم تویی چیزی بده درویش را
تلخ از تو شیرین می شود کفر از تو چو","[[-5.3885411e-05 -1.5761040e-08 -5.0820890e-06 ...  1.4311350e-04
  -1.4049332e-05  2.1295527e-04]]",غزلیات مولوی,15
15,"ای یوسف آخر سوی این یعقوب نابینا بیا	ای عیسی پنهان شده بر طارم مینا بیا
از هجر روزم قیر شد دل چون کمان بد تیر شد	یعقوب مسکین پیر شد ای یوسف برنا بیا
ای موسی عمران که در سینه چه سیناهاستت	گاوی خدایی می کند از سینه سینا بیا
رخ زعفران رنگ آمدم خم داده چون چنگ آمدم	در گور تن تنگ آمدم ای جان باپهنا بیا
چشم محمد با نمت واشوق گفته در غمت	زان طره ای اندرهمت ای سر ارسلنا بیا
خورشید پیشت چون شفق ای برده از شاهان سبق	ای دیده بینا به حق وی سینه دانا بیا
ای جان تو و جان ها چو تن بی جان چه ارزد خود بدن	دل داد","[[-3.9516304e-05 -4.0266812e-08 -1.6099642e-06 ...  2.4007203e-03
  -1.4909491e-05 -7.5438002e-05]]",غزلیات مولوی,16
16,"آمد ندا از آسمان جان را که بازآ الصلا	جان گفت ای نادی خوش اهلا و سهلا مرحبا
سمعا و طاعه ای ندا هر دم دو صد جانت فدا	یک بار دیگر بانگ زن تا برپرم بر هل اتی
ای نادره مهمان ما بردی قرار از جان ما	آخر کجا می خوانیم گفتا برون از جان و جا
از پای این زندانیان بیرون کنم بند گران	بر چرخ بنهم نردبان تا جان برآید بر علا
تو جان جان افزاستی آخر ز شهر ماستی	دل بر غریبی می نهی این کی بود شرط وفا
آوارگی نوشت شده خانه فراموشت شده	آن گنده پیر کابلی صد سحر کردت از دغا
این قافله بر قافله پویان سوی آن مرحله	چون برنم","[[-1.4150108e-04 -4.1903786e-07 -3.1365911e-05 ...  8.0465304e-04
  -2.4964083e-05 -3.8040275e-04]]",غزلیات مولوی,17
17,"ای یوسف خوش نام ما خوش می روی بر بام ما	انا فتحنا الصلا بازآ ز بام از در درآ
ای بحر پرمرجان من والله سبک شد جان من	این جان سرگردان من از گردش این آسیا
ای ساربان با قافله مگذر مرو زین مرحله	اشتر بخوابان هین هله نه از بهر من بهر خدا
نی نی برو مجنون برو خوش در میان خون برو	از چون مگو بی چون برو زیرا که جان را نیست جا
گر قالبت در خاک شد جان تو بر افلاک شد	گر خرقه تو چاک شد جان تو را نبود فنا
از سر دل بیرون نه ای بنمای رو کایینه ای	چون عشق را سرفتنه ای پیش تو آید فتنه ها
گویی مرا چون می روی گستاخ و ا",[[0.00460863 0.00136273 0.00714504 ... 0.01917812 0.00903979 0.01664021]],غزلیات مولوی,18
18,"امروز دیدم یار را آن رونق هر کار را	می شد روان بر آسمان همچون روان مصطفی
خورشید از رویش خجل گردون مشبک همچو دل	از تابش او آب و گل افزون ز آتش در ضیا
گفتم که بنما نردبان تا برروم بر آسمان	گفتا سر تو نردبان سر را درآور زیر پا
چون پای خود بر سر نهی پا بر سر اختر نهی	چون تو هوا را بشکنی پا بر هوا نه هین بیا
بر آسمان و بر هوا صد رد پدید آید تو را	بر آسمان پران شوی هر صبحدم همچون دعا","[[-1.7339534e-04  1.2892830e-06 -2.0737561e-06 ... -6.5066610e-07
  -3.1868138e-05 -1.3943705e-04]]",غزلیات مولوی,19
19,"چندانک خواهی جنگ کن یا گرم کن تهدید را	می دان که دود گولخن هرگز نیاید بر سما
ور خود برآید بر سما کی تیره گردد آسمان	کز دود آورد آسمان چندان لطیفی و ضیا
خود را مرنجان ای پدر سر را مکوب اندر حجر	با نقش گرمابه مکن این جمله چالیش و غزا
گر تو کنی بر مه تفو بر روی تو بازآید آن	ور دامن او را کشی هم بر تو تنگ آید قبا
پیش از تو خامان دگر در جوش این دیگ جهان	بس برطپیدند و نشد درمان نبود الا رضا
بگرفت دم مار را یک خارپشت اندر دهن	سر درکشید و گرد شد مانند گویی آن دغا
آن مار ابله خویش را بر خار می زد دم به د","[[-1.07279469e-04  1.54042733e-04 -4.68779297e-04 ...  1.07842774e-04
  -4.62610951e-05  4.18970687e-03]]",غزلیات مولوی,20
20,"جرمی ندارم بیش از این کز دل هوا دارم تو را	از زعفران روی من رو می بگردانی چرا
یا این دل خون خواره را لطف و مراعاتی بکن	یا قوت صبرش بده در یفعل الله ما یشا
این دو ره آمد در روش یا صبر یا شکر نعم	بی شمع روی تو نتان دیدن مر این دو راه را
هر گه بگردانی تو رو آبی ندارد هیچ جو	کی ذره ها پیدا شود بی شعشعه شمس الضحی
بی باده تو کی فتد در مغز نغزان مستی یی	بی عصمت تو کی رود شیطان بلا حول و لا
نی قرص سازد قرصی یی مطبوخ هم مطبوخیی	تا درنیندازی کفی ز اهلیله خود در دوا
امرت نغرد کی رود خورشید در برج اسد	بی تو","[[ 8.7029655e-03 -1.6553848e-05  2.9187740e-03 ...  1.5992654e-02
   1.3465778e-02  1.6689995e-02]]",غزلیات مولوی,21
21,"چندان بنالم ناله ها چندان برآرم رنگ ها	تا برکنم از آینه هر منکری من زنگ ها
بر مرکب عشق تو دل می راند و این مرکبش	در هر قدم می بگذرد زان سوی جان فرسنگ ها
بنما تو لعل روشنت بر کوری هر ظلمتی	تا بر سر سنگین دلان از عرش بارد سنگ ها
با این چنین تابانیت دانی چرا منکر شدند	کاین دولت و اقبال را باشد از ایشان ننگ ها
گر نی که کورندی چنین آخر بدیدندی چنان	آن سو هزاران جان ز مه چون اختران آونگ ها
چون از نشاط نور تو کوران همی بینا شوند	تا از خوشی راه تو رهوار گردد لنگ ها
اما چو اندر راه تو ناگاه بیخود می شود	",[[0.0083297  0.00153995 0.00407281 ... 0.01383712 0.00203302 0.02529895]],غزلیات مولوی,22
22,"چون خون نخسپد خسروا چشمم کجا خسپد مها	کز چشم من دریای خون جوشان شد از جور و جفا
گر لب فروبندم کنون جانم به جوش آید درون	ور بر سرش آبی زنم بر سر زند او جوش را
معذور دارم خلق را گر منکرند از عشق ما	اه لیک خود معذور را کی باشد اقبال و سنا
از جوش خون نطقی به فم آن نطق آمد در قلم	شد حرف ها چون مور هم سوی سلیمان لابه را
کای شه سلیمان لطف وی لطف را از تو شرف	در تو را جان ها صدف باغ تو را جان ها گیا
ما مور بیچاره شده وز خرمن آواره شده	در سیر سیاره شده هم تو برس فریاد ما
ما بنده خاک کفت چون چاکران اندر ص",[[0.00078852 0.05192312 0.00696748 ... 0.00432812 0.00728331 0.01505941]],غزلیات مولوی,23
23,"چون نالد این مسکین که تا رحم آید آن دلدار را	خون بارد این چشمان که تا بینم من آن گلزار را
خورشید چون افروزدم تا هجر کمتر سوزدم	دل حیلتی آموزدم کز سر بگیرم کار را
ای عقل کل ذوفنون تعلیم فرما یک فسون	کز وی بخیزد در درون رحمی نگارین یار را
چون نور آن شمع چگل می درنیابد جان و دل	کی داند آخر آب و گل دلخواه آن عیار را
جبریل با لطف و رشد عجل سمین را چون چشد	این دام و دانه کی کشد عنقای خوش منقار را
عنقا که یابد دام کس در پیش آن عنقامگس	ای عنکبوت عقل بس تا کی تنی این تار را
کو آن مسیح خوش دمی بی واسطه مر","[[-8.4302505e-05  5.4892462e-02  6.4047832e-05 ...  1.8074648e-02
   3.5458026e-03  2.3394803e-02]]",غزلیات مولوی,24
24,"من دی نگفتم مر تو را کای بی نظیر خوش لقا	ای قد مه از رشک تو چون آسمان گشته دوتا
امروز صد چندان شدی حاجب بدی سلطان شدی	هم یوسف کنعان شدی هم فر نور مصطفی
امشب ستایمت ای پری فردا ز گفتن بگذری	فردا زمین و آسمان در شرح تو باشد فنا
امشب غنیمت دارمت باشم غلام و چاکرت	فردا ملک بی هش شود هم عرش بشکافد قبا
ناگه برآید صرصری نی بام ماند نه دری	زین پشگان پر کی زند چونک ندارد پیل پا
باز از میان صرصرش درتابد آن حسن و فرش	هر ذره ای خندان شود در فر آن شمس الضحی
تعلیم گیرد ذره ها زان آفتاب خوش لقا	صد ذرگی دلربا ک",[[0.00090305 0.00145089 0.00648257 ... 0.02099278 0.00096745 0.01270764]],غزلیات مولوی,25
25,"هر لحظه وحی آسمان آید به سر جان ها	کاخر چو دردی بر زمین تا چند می باشی برآ
هر کز گران جانان بود چون درد در پایان بود	آنگه رود بالای خم کان درد او یابد صفا
گل را مجنبان هر دمی تا آب تو صافی شود	تا درد تو روشن شود تا درد تو گردد دوا
جانیست چون شعله ولی دودش ز نورش بیشتر	چون دود از حد بگذرد در خانه ننماید ضیا
گر دود را کمتر کنی از نور شعله برخوری	از نور تو روشن شود هم این سرا هم آن سرا
در آب تیره بنگری نی ماه بینی نی فلک	خورشید و مه پنهان شود چون تیرگی گیرد هوا
باد شمالی می وزد کز وی هوا صافی شود	و",[[0.00099994 0.00368444 0.00276518 ... 0.00031162 0.00186727 0.02125179]],غزلیات مولوی,26
