,output_id,output_text,hekmat_number
185,5590,و قال ع اول عوض الحلیم من حلمه ان الناس انصاره علی الجاهل ,2##206
186,5591,و قال ع ان لم تکن حلیما فتحلم فانه قل من تشبه بقوم الا اوشک ان یکون منهم ,2##207
187,5592,و قال ع من حاسب نفسه ربح و من غفل عنها خسر و من خاف امن و من اعتبر ابصر و من ابصر فهم و من فهم علم ,2##208
188,5593,و قال ع لتعطفن الدنیا علینا بعد شماسها عطف الضروس علی ولدها و تلا عقیب ذلکو نرید ان نمن علی الذین استضعفوا فی الارض و نجعلهم ائمه و نجعلهم الوارثین ,2##209
189,5594,و قال ع اتقوا الله تقیه من شمر تجریدا و جد تشمیرا و کمش فی مهل و بادر عن وجل و نظر فی کره الموئل و عاقبه المصدر و مغبه المرجع ,2##210
190,5595,و قال ع عجب المرء بنفسه احد حساد عقله ,2##212
191,5596,و قال ع اغض علی القذی و الالم ترض ابدا ,2##213
192,5597,و قال ع من لان عوده کثفت اغصانه ,2##214
193,5598,و قال ع الخلاف یهدم الرای‌ ,2##215
194,5599,و قال ع من نال استطال ,2##216
195,5600,و قال ع فی تقلب الاحوال علم جواهر الرجال ,2##217
196,5601,و قال ع حسد الصدیق من سقم الموده ,2##218
197,5602,و قال ع اکثر مصارع العقول تحت بروق المطامع ,2##219
198,5603,و قال ع لیس من العدل القضاء علی الثقه بالظن ,2##220
199,5604,و قال ع بئس الزاد الی المعاد العدوان علی العباد ,2##221
200,5605,و قال ع من اشرف اعمال الکریم غفلته عما یعلم ,2##222
201,5606,و قال ع من کساه الحیاء ثوبه لم یر الناس عیبه ,2##223
202,5607,و قال ع بکثره الصمت تکون الهیبه و بالنصفه یکثر المواصلون و بالافضال تعظم الاقدار و بالتواضع تتم النعمه و باحتمال المؤن یجب السؤدد و بالسیره العادله یقهر المناو‌ئ و بالحلم عن السفیه تکثر الانصار علیه ,2##224
203,5608,و قال ع العجب لغفله الحساد عن سلامه الاجساد ,2##225
204,5609,و قال ع الطامع فی وثاق الذل ,2##226
205,5610,و سئل عن الایمان فقال الایمان معرفه بالقلب و اقرار باللسان و عمل بالارکان ,2##227
206,5611,و قال ع کفی بالقناعه ملکا و بحسن الخلق نعیما و سئل ع عن قوله تعالیفلنحیینه حیاه طیبه فقال هی‌ القناعه ,2##229
207,5612,و قال ع شارکوا الذی قد اقبل علیه الرزق فانه اخلق للغنی و اجدر باقبال الحظ علیه ,2##230
208,5613,و قال ع فی قوله تعالیان الله یامر بالعدل و الاحسانالعدل الانصاف و الاحسان التفضل ,2##231
209,5614,و قال ع من یعط بالید القصیره یعط بالید الطویله ,2##232
210,5615,و قال ع لابنه الحسن ع لا تدعون الی مبارزه و ان دعیت الیها فاجب فان الداعی‌ الیها باغ و الباغی‌ مصروع ,2##233
211,5616,و قال ع خیار خصال النساء شرار خصال الرجال الزهو و الجبن و البخل فاذا کانت المراه مزهوه لم تمکن من نفسها و اذا کانت بخیله حفظت مالها و مال بعلها و اذا کانت جبانه فرقت من کل شیء یعرض لها ,2##234
212,5617,و قیل له صف لنا العاقل فقال ع هو الذی یضع الشی‌ء مواضعه فقیل فصف لنا الجاهل فقال قد فعلت ,2##235
213,5618,و قال ع و الله لدنیاکم هذه اهون فی عینی من عراق خنزیر فی ید مجذوم ,2##236
214,5619,و قال ع ان قوما عبدوا الله رغبه فتلک عباده التجار و ان قوما عبدوا الله رهبه فتلک عباده العبید و ان قوما عبدوا الله شکرا فتلک عباده الاحرار ,2##237
215,5620,و قال ع المراه شر کلها و شر ما فیها انه لا بد منها ,2##238
216,5621,و قال ع من اطاع التوانی‌ ضیع الحقوق و من اطاع الواشی‌ ضیع الصدیق ,2##239
217,5622,و قال ع الحجر الغصیب فی الدار رهن علی خرابها ,2##240
218,5623,و قال ع یوم المظلوم علی الظالم اشد من یوم الظالم علی المظلوم ,2##241
219,5624,و قال ع اتق الله بعض التقی و ان قل و اجعل بینک و بین الله سترا و ان رق ,2##242
220,5625,و قال ع اذا ازدحم الجواب خفی‌ الصواب ,2##243
221,5626,و قال ع ان لله فی کل نعمه حقا فمن اداه زاده منها و من قصر فیه خاطر بزوال نعمته ,2##244
222,5627,و قال ع اذا کثرت المقدره قلت الشهوه ,2##245
223,5628,و قال ع احذروا نفار النعم فما کل شارد بمردود ,2##246
224,5629,و قال ع الکرم اعطف من الرحم ,2##247
225,5630,و قال ع من ظن بک خیرا فصدق ظنه ,2##248
226,5631,و قال ع افضل الاعمال ما اکرهت نفسک علیه ,2##249
227,5632,و قال ع عرفت الله سبحانه بفسخ العزائم و حل العقود و نقض الهمم ,2##250
228,5633,و قال ع مراره الدنیا حلاوه الاخره و حلاوه الدنیا مراره الاخره ,2##251
229,5634,و کان ع یقول احلفوا الظالم اذا اردتم یمینه بانه بری‌ء من حول الله و قوته فانه اذا حلف بها کاذبا عوجل العقوبه و اذا حلف بالله الذی لا اله الا هو لم یعاجل لانه قد وحد الله تعالی ,2##253
230,5635,و قال ع یا ابن ادم کن وصی‌ نفسک فی مالک و اعمل فیه ما تؤثر ان یعمل فیه من بعدک ,2##254
231,5636,و قال ع الحده ضرب من الجنون لان صاحبها یندم فان لم یندم فجنونه مستحکم ,2##255
232,5637,و قال ع صحه الجسد من قله الحسد ,2##256
233,5638,و قال ع اذا املقتم فتاجروا الله بالصدقه ,2##258
234,5639,و قال ع الوفاء لاهل الغدر غدر عند الله و الغدر باهل الغدر وفاء عند الله ,2##259
235,5640,و قال ع صاحب السلطان کراکب الاسد یغبط بموقعه و هو اعلم بموضعه ,2##263
236,5641,و قال ع احسنوا فی عقب غیرکم تحفظوا فی عقبکم ,2##264
237,5642,و قال ع ان کلام الحکماء اذا کان صوابا کان دواء و اذا کان خطا کان داء ,2##265
238,5643,و ساله رجل ان یعرفه الایمان فقال ع اذا کان الغد فاتنی حتی اخبرک علی اسماع الناس فان نسیت مقالتی حفظها علیک غیرک فان الکلام کالشارده ینقفها هذا و یخطئها هذا ,2##266
239,5644,و قال ع یا ابن ادم لا تحمل هم یومک الذی لم یاتک علی یومک الذی قد اتاک فانه ان یک من عمرک یات الله فیه برزقک ,2##267
240,5645,و قال ع احبب حبیبک هونا ما عسی ان یکون بغیضک یوما ما و ابغض بغیضک هونا ما عسی ان یکون حبیبک یوما ما ,2##268
241,5646,روی‌ انه ع رفع الیه رجلان سرقا من مال الله احدهما عبد من مال الله و الاخر من عروض الناس فقال ع اما هذا فهو من مال الله و لا حد علیه مال الله اکل بعضه بعضا و اما الاخر فعلیه الحد الشدید فقطع یده ,2##271
242,5647,و قال ع لو قد استوت قدمای‌ من هذه المداحض لغیرت اشیاء ,2##272
243,5648,و قال ع لا تجعلوا علمکم جهلا و یقینکم شکا اذا علمتم فاعملوا و اذا تیقنتم فاقدموا ,2##274
244,5649,و قال ع ان الطمع مورد غیر مصدر و ضامن غیر وفی‌ و ربما شرق شارب الماء قبل ریه و کلما عظم قدر الشی‌ء المتنافس فیه عظمت الرزیه لفقده و الامانی‌ تعمی اعین البصائر و الحظ یاتی من لا یاتیه ,2##275
245,5650,و قال ع اللهم انی اعوذ بک من ان تحسن فی لامعه العیون علانیتی و تقبح فیما ابطن لک سریرتی محافظا علی رثاء الناس من نفسی بجمیع ما انت مطلع علیه منی فابدی‌ للناس حسن ظاهری و افضی‌ الیک بسوء عملی تقربا الی عبادک و تباعدا من مرضاتک ,2##276
246,5651,و قال ع لا و الذی امسینا منه فی غبر لیله دهماء تکشر عن یوم اغر ما کان کذا و کذا ,2##277
247,5652,و قال ع قلیل تدوم علیه ارجی من کثیر مملول منه ,2##278
248,5653,و قال ع اذا اضرت النوافل بالفرائض فارفضوها ,2##279
249,5654,و قال ع من تذکر بعد السفر استعد ,2##280
250,5655,و قال ع لیست الرویه کالمعاینه مع الابصار فقد تکذب العیون اهلها و لا یغش العقل من استنصحه ,2##281
251,5656,و قال ع بینکم و بین الموعظه حجاب من الغره ,2##282
252,5657,و قال ع جاهلکم مزداد و عالمکم مسوف ,2##283
253,5658,و قال ع قطع العلم عذر المتعللین ,2##284
254,5659,و قال ع کل معاجل یسال الانظار و کل مؤجل یتعلل بالتسویف ,2##285
255,5660,و قال ع ما قال الناس لشی‌ء طوبی له الا و قد خبا له الدهر یوم سوء ,2##286
256,5661,و سئل عن القدر فقال طریق مظلم فلا تسلکوه و بحر عمیق فلا تلجوه و سر الله فلا تتکلفوه ,2##287
257,5662,و قال ع اذا ارذل الله عبدا حظر علیه العلم ,2##288
258,5663,و قال ع لو لم یتوعد الله علی معصیته لکان یجب الا یعصی شکرا لنعمه ,2##290
259,5664,و قال ع علی قبر رسول اللهص ساعه دفنه ان الصبر لجمیل الا عنک و ان الجزع لقبیح الا علیک و ان المصاب بک لجلیل و انه قبلک و بعدک لجلل ,2##292
260,5665,و قال ع لا تصحب المائق فانه یزین لک فعله و یود ان تکون مثله ,2##293
261,5666,و قد سئل عن مسافه ما بین المشرق و المغرب فقال ع مسیره یوم للشمس ,2##294
262,5667,و قال ع اصدقاؤک ثلاثه و اعداؤک ثلاثه فاصدقاؤک صدیقک و صدیق صدیقک و عدو عدوک و اعداؤک عدوک و عدو صدیقک و صدیق عدوک ,2##295
263,5668,و قال ع لرجل راه یسعی علی عدو له بما فیه اضرار بنفسه انما انت کالطاعن نفسه لیقتل ردفه ,2##296
264,5669,و قال ع ما اکثر العبر و اقل الاعتبار ,2##297
265,5670,و قال ع من بالغ فی الخصومه اثم و من قصر فیها ظلم و لا یستطیع ان یتقی‌ الله من خاصم ,2##298
266,5671,و قال ع ما اهمنی ذنب امهلت بعده حتی اصلی‌ رکعتین و اسال الله العافیه ,2##299
267,5672,و سئل ع کیف یحاسب الله الخلق علی کثرتهم فقال ع کما یرزقهم علی کثرتهم فقیل کیف یحاسبهم و لا یرونه فقال ع کما یرزقهم و لا یرونه ,2##300
268,5673,و قال ع رسولک ترجمان عقلک و کتابک ابلغ ما ینطق عنک ,2##301
269,5674,و قال ع ما المبتلی الذی قد اشتد به البلاء باحوج الی الدعاء الذی لا یامن البلاء ,2##302
270,5675,و قال ع الناس ابناء الدنیا و لا یلام الرجل علی حب امه ,2##303
271,5676,و قال ع ان المسکین رسول الله فمن منعه فقد منع الله و من اعطاه فقد اعطی الله ,2##304
272,5677,و قال ع ما زنی غیور قط ,2##305
273,5678,و قال ع کفی بالاجل حارسا ,2##306
274,5679,و قال ع ینام الرجل علی الثکل و لا ینام علی الحرب ,2##307
275,5680,و قال ع موده الاباء قرابه بین الابناء و القرابه الی الموده احوج من الموده الی القرابه ,2##308
276,5681,و قال ع اتقوا ظنون المؤمنین فان الله تعالی جعل الحق علی السنتهم ,2##309
277,5682,و قال ع لا یصدق ایمان عبد حتی یکون بما فی ید الله اوثق منه بما فی یده ,2##310
278,5683,و قال ع لانس بن مالک و قد کان بعثه الی طلحه و الزبیر لما جاء الی البصره یذکرهما شیئا مما سمعه من رسول اللهص فی معناهما فلوی عن ذلک فرجع الیه فقال انی انسیت ذلک الامر فقال ع ان کنت کاذبا فضربک الله بها بیضاء لامعه لا تواریها العمامه ,2##311
279,5684,و قال ع ان للقلوب اقبالا و ادبارا فاذا اقبلت فاحملوها علی النوافل و اذا ادبرت فاقتصروا بها علی الفرائض ,2##312
280,5685,و قال ع و فی القران نبا ما قبلکم و خبر ما بعدکم و حکم ما بینکم ,2##313
281,5686,و قال ع ردوا الحجر من حیث جاء فان الشر لا یدفعه الا الشر ,2##314
282,5687,و قال ع لکاتبه عبید الله بن ابی رافع الق دواتک و اطل جلفه قلمک و فرج بین السطور و قرمط بین الحروف فان ذلک اجدر بصباحه الخط ,2##315
283,5688,و قال ع انا یعسوب المؤمنین و المال یعسوب الفجار ,2##316
284,5689,و قال له بعض الیهود ما دفنتم نبیکم حتی اختلفتم فیه فقال ع له انما اختلفنا عنه لا فیه و لکنکم ما جفت ارجلکم من البحر حتی قلتم لنبیکماجعل لنا الها کما لهم الهه قال انکم قوم تجهلون ,2##317
285,5690,و قیل له بای‌ شیء غلبت الاقران فقال ع ما لقیت رجلا الا اعاننی علی نفسه ,2##318
286,5691,و قال ع لابنه محمد ابن الحنفیه یا بنی‌ انی اخاف علیک الفقر فاستعذ بالله منه فان الفقر منقصه للدین مدهشه للعقل داعیه للمقت ,2##319
287,5692,و قال ع لسائل ساله عن معضله سل تفقها و لا تسال تعنتا فان الجاهل المتعلم شبیه بالعالم و ان العالم المتعسف شبیه بالجاهل المتعنت ,2##320
288,5693,و قال ع لعبد الله بن العباس و قد اشار الیه فی شیء لم یوافق رایه لک ان تشیر علی و اری فان عصیتک فاطعنی ,2##321
289,5694,و قال ع و قد مر بقتلی الخوارج یوم النهروان بؤسا لکم لقد ضرکم من غرکم فقیل له من غرهم یا امیر المؤمنین فقال الشیطان المضل و الانفس الاماره بالسوء غرتهم بالامانی‌ و فسحت لهم بالمعاصی و وعدتهم الاظهار فاقتحمت بهم النار ,2##323
290,5695,و قال ع اتقوا معاصی‌ الله فی الخلوات فان الشاهد هو الحاکم ,2##324
291,5696,و قال ع لما بلغه قتل محمد بن ابی بکر ان حزننا علیه علی قدر سرورهم به الا انهم نقصوا بغیضا و نقصنا حبیبا ,2##325
292,5697,و قال ع العمر الذی اعذر الله فیه الی ابن ادم ستون سنه ,2##326
293,5698,و قال ع ما ظفر من ظفر الاثم به و الغالب بالشر مغلوب ,2##327
294,5699,و قال ع ان الله سبحانه فرض فی اموال الاغنیاء اقوات الفقراء فما جاع فقیر الا بما متع به غنی‌ و الله تعالی سائلهم عن ذلک ,2##328
295,5700,و قال ع الاستغناء عن العذر اعز من الصدق به ,2##329
296,5701,و قال ع اقل ما یلزمکم لله الا تستعینوا بنعمه علی معاصیه ,2##330
297,5702,و قال ع ان الله سبحانه جعل الطاعه غنیمه الاکیاس عند تفریط العجزه ,2##331
298,5703,و قال ع السلطان وزعه الله فی ارضه ,2##332
299,5704,و قال ع فی صفه المؤمن المؤمن بشره فی وجهه و حزنه فی قلبه اوسع شیء صدرا و اذل شیء نفسا یکره الرفعه و یشنا السمعه طویل غمه بعید همه کثیر صمته مشغول وقته شکور صبور مغمور بفکرته ضنین بخلته سهل الخلیقه لین العریکه نفسه اصلب من الصلد و هو اذل من العبد ,2##333
300,5705,و قال ع لو رای العبد الاجل و مصیره لابغض الامل و غروره ,2##334
301,5706,و قال ع لکل امر‌ئ فی ماله شریکان الوارث و الحوادث ,2##335
302,5707,و قال ع المسئول حر حتی یعد ,2##336
303,5708,و قال ع الداعی بلا عمل کالرامی بلا وتر ,2##337
304,5709,و قال ع العلم علمان مطبوع و مسموع و لا ینفع المسموع اذا لم یکن المطبوع ,2##338
305,5710,و قال ع صواب الرای‌ بالدول یقبل باقبالها و یذهب بذهابها ,2##339
306,5711,و قال ع العفاف زینه الفقر و الشکر زینه الغنی ,2##340
307,5712,و قال ع یوم العدل علی الظالم اشد من یوم الجور علی المظلوم ,2##341
308,5713,و قال ع الغنی الاکبر الیاس عما فی ایدی الناس ,2##342
309,5714,و قال ع الاقاویل محفوظه و السرائر مبلوه وکل نفس بما کسبت رهینه و الناس منقوصون مدخولون الا من عصم الله سائلهم متعنت و مجیبهم متکلف یکاد افضلهم رایا یرده عن فضل رایه الرضی و السخط و یکاد اصلبهم عودا تنکؤه اللحظه و تستحیله الکلمه الواحده ,2##343
310,5715,و قال ع معاشر الناس اتقوا الله فکم من مؤمل ما لا یبلغه و بان ما لا یسکنه و جامع ما سوف یترکه و لعله من باطل جمعه و من حق منعه اصابه حراما و احتمل به اثاما فباء بوزره و قدم علی ربه اسفا لاهفا قدخسر الدنیا و الاخره ذلک هو الخسران المبین ,2##344
311,5716,و قال ع من العصمه تعذر المعاصی‌ ,2##345
312,5717,و قال ع ماء وجهک جامد یقطره السؤال فانظر عند من تقطره ,2##346
313,5718,و قال ع الثناء باکثر من الاستحقاق ملق و التقصیر عن الاستحقاق عی‌ او حسد ,2##347
314,5719,و قال ع اشد الذنوب ما استهان به صاحبه ,2##348
315,5720,و قال ع للظالم من الرجال ثلاث علامات یظلم من فوقه بالمعصیه و من دونه بالغلبه و یظاهر القوم الظلمه ,2##350
316,5721,و قال ع  عند تناهی الشده تکون الفرجه و عند تضایق حلق البلاء یکون الرخاء ,2##351
317,5722,و قال ع لبعض اصحابه لا تجعلن اکثر شغلک باهلک و ولدک فان یکن اهلک و ولدک اولیاء الله فان الله لا یضیع اولیاءه و ان یکونوا اعداء الله فما همک و شغلک باعداء الله ,2##352
318,5723,و قال ع اکبر العیب ان تعیب ما فیک مثله ,2##353
319,5724,و هنا بحضرته رجل رجلا بغلام ولد له فقال له لیهنئک الفارس فقال ع لا تقل ذلک و لکن قل شکرت الواهب و بورک لک فی الموهوب و بلغ اشده و رزقت بره ,2##354
320,5725,و بنی رجل من عماله بناء فخما فقال ع اطلعت الورق رءوسها ان البناء یصف لک الغنی ,2##355
321,5726,و عزی قوما عن میت مات لهم فقال ع ان هذا الامر لیس لکم بدا و لا الیکم انتهی و قد کان صاحبکم هذا یسافر فعدوه فی بعض اسفاره فان قدم علیکم و الا قدمتم علیه ,2##357
322,5727,و قیل له ع لو سد علی رجل باب بیته و ترک فیه من این کان یاتیه رزقه فقال ع من حیث یاتیه اجله ,2##356
323,5728,و قال ع ایها الناس لیرکم الله من النعمه وجلین کما یراکم من النقمه فرقین انه من وسع علیه فی ذات یده فلم یر ذلک استدراجا فقد امن مخوفا و من ضیق علیه فی ذات یده فلم یر ذلک اختبارا فقد ضیع مامولا ,2##358
324,5729,و قال ع یا اسری الرغبه اقصروا فان المعرج علی الدنیا لا یروعه منها الا صریف انیاب الحدثان ایها الناس تولوا من انفسکم تادیبها و اعدلوا بها عن ضراوه عاداتها ,2##359
325,5730,و قال ع لا تظنن بکلمه خرجت من احد سوءا و انت تجد لها فی الخیر محتملا ,2##360
326,5731,و قال ع اذا کانت لک الی الله سبحانه حاجه فابدا بمساله الصلاه علی رسولهص ثم سل حاجتک فان الله اکرم من ان یسال حاجتین فیقضی‌ احداهما و یمنع الاخری ,2##361
327,5732,و قال ع من ضن بعرضه فلیدع المراء ,2##362
328,5733,و قال ع من الخرق المعاجله قبل الامکان و الاناه بعد الفرصه ,2##363
329,5734,و قال ع لا تسال عما لا یکون ففی الذی قد کان لک شغل ,2##364
330,5735,و قال ع الفکر مراه صافیه و الاعتبار منذر ناصح و کفی ادبا لنفسک تجنبک ما کرهته لغیرک ,2##365
331,5736,و قال ع العلم مقرون بالعمل فمن علم عمل و العلم یهتف بالعمل فان اجابه و الا ارتحل عنه ,2##366
332,5737,و قال ع ان الله سبحانه وضع الثواب علی طاعته و العقاب علی معصیته ذیاده لعباده عن نقمته و حیاشه لهم الی جنته ,2##368
333,5738,و عن ابی جحیفه قال سمعت امیر المؤمنین ع یقول اول ما تغلبون علیه من الجهاد الجهاد بایدیکم ثم بالسنتکم ثم بقلوبکم فمن لم یعرف بقلبه معروفا و لم ینکر منکرا قلب فجعل اعلاه اسفله و اسفله اعلاه ,2##375
334,5739,و قال ع ان الحق ثقیل مری‌ء و ان الباطل خفیف وبی‌ء ,2##376
335,5740,و قال ع لا تامنن علی خیر هذه الامه عذاب الله لقوله تعالیفلا یامن مکر الله الا القوم الخاسرون و لا تیاسن لشر هذه الامه من روح الله لقوله تعالیانه لا ییاس من روح الله الا القوم الکافرون ,2##377
336,5741,و قال ع البخل جامع لمساو‌ئ العیوب و هو زمام یقاد به الی کل سوء ,2##378
337,5742,و قال ع رب مستقبل یوما لیس بمستدبره و مغبوط فی اول لیله قامت بواکیه فی اخره ,2##380
338,5743,و قال ع الکلام فی وثاقک ما لم تتکلم به فاذا تکلمت به صرت فی وثاقه فاخزن لسانک کما تخزن ذهبک و ورقک فرب کلمه سلبت نعمه و جلبت نقمه ,2##381
339,5744,و قال ع لا تقل ما لا تعلم بل لا تقل کل ما تعلم فان الله فرض علی جوارحک کلها فرائض یحتج بها علیک یوم القیامه ,2##382
340,5745,و قال ع احذر ان یراک الله عند معصیته و یفقدک عند طاعته فتکون من الخاسرین و اذا قویت فاقو علی طاعه الله و اذا ضعفت فاضعف عن معصیه الله ,2##383
341,5746,و قال ع الرکون الی الدنیا مع ما تعاین منها جهل و التقصیر فی حسن العمل اذا وثقت بالثواب علیه غبن و الطمانینه الی کل احد قبل الاختبار له عجز ,2##384
342,5747,و قال ع من هوان الدنیا علی الله انه لا یعصی الا فیها و لا ینال ما عنده الا بترکها ,2##385
