,output_id,output_text,hekmat_number
343,5748,و قال ع من طلب شیئا ناله او بعضه ,2##386
344,5749,و قال ع ما خیر بخیر بعده النار و ما شر بشر بعده الجنه و کل نعیم دون الجنه فهو محقور و کل بلاء دون النار عافیه ,2##387
345,5750,و قال ع الا و ان من البلاء الفاقه و اشد من الفاقه مرض البدن و اشد من مرض البدن مرض القلب الا و ان من صحه البدن تقوی القلب ,2##388
346,5751,و قال ع من ابطا به عمله لم یسرع به نسبه و فی روایه اخری من فاته حسب نفسه لم ینفعه حسب ابائه ,2##389
347,5752,و قال ع للمؤمن ثلاث ساعات فساعه یناجی فیها ربه و ساعه یرم معاشه و ساعه یخلی بین نفسه و بین لذتها فیما یحل و یجمل و لیس للعاقل ان یکون شاخصا الا فی ثلاث مرمه لمعاش او خطوه فی معاد او لذه فی غیر محرم ,2##390
348,5753,و قال ع ازهد فی الدنیا یبصرک الله عوراتها و لا تغفل فلست بمغفول عنک ,2##391
349,5754,و قال ع تکلموا تعرفوا فان المرء مخبوء تحت لسانه ,2##392
350,5755,و قال ع خذ من الدنیا ما اتاک و تول عما تولی عنک فان انت لم تفعل فاجمل فی الطلب ,2##393
351,5756,و قال ع رب قول انفذ من صول ,2##394
352,5757,و قال ع کل مقتصر علیه کاف ,2##395
353,5758,و قال ع المنیه و لا الدنیه و التقلل و لا التوسل و من لم یعط قاعدا لم یعط قائما و الدهر یومان یوم لک و یوم علیک فاذا کان لک فلا تبطر و اذا کان علیک فاصبر ,2##396
354,5759,و قال ع نعم الطیب المسک خفیف محمله عطر ریحه ,2##397
355,5760,و قال ع ضع فخرک و احطط کبرک و اذکر قبرک ,2##398
356,5761,و قال ع ان للولد علی الوالد حقا و ان للوالد علی الولد حقا فحق الوالد علی الولد ان یطیعه فی کل شیء الا فی معصیه الله سبحانه و حق الولد علی الوالد ان یحسن اسمه و یحسن ادبه و یعلمه القران ,2##399
357,5762,و قال ع العین حق و الرقی حق و السحر حق و الفال حق و الطیره لیست بحق و العدوی لیست بحق و الطیب نشره و العسل نشره و الرکوب نشره و النظر الی الخضره نشره ,2##400
358,5763,و قال ع مقاربه الناس فی اخلاقهم امن من غوائلهم ,2##401
359,5764,و قال ع لبعض مخاطبیه و قد تکلم بکلمه یستصغر مثله عن قول مثلها لقد طرت شکیرا و هدرت سقبا ,2##402
360,5765,و قال ع من اوما الی متفاوت خذلته الحیل ,2##403
361,5766,و قال ع و قد سئل عن معنی قولهم لا حول و لا قوه الا بالله انا لا نملک مع الله شیئا و لا نملک الا ما ملکنا فمتی ملکنا ما هو املک به منا کلفنا و متی اخذه منا وضع تکلیفه عنا ,2##404
362,5767,و قال ع لعمار بن یاسر و قد سمعه یراجع المغیره بن شعبه کلاما دعه یا عمار فانه لم یاخذ من الدین الا ما قاربه من الدنیا و علی عمد لبس علی نفسه لیجعل الشبهات عاذرا لسقطاته ,2##405
363,5768,و قال ع ما احسن تواضع الاغنیاء للفقراء طلبا لما عند الله و احسن منه تیه الفقراء علی الاغنیاء اتکالا علی الله ,2##406
364,5769,و قال ع ما استودع الله امرا عقلا الا استنقذه به یوما ما ,2##407
365,5770,و قال ع من صارع الحق صرعه ,2##408
366,5771,و قال ع القلب مصحف البصر ,2##409
367,5772,و قال ع التقی رئیس الاخلاق ,2##410
368,5773,و قال ع لا تجعلن ذرب لسانک علی من انطقک و بلاغه قولک علی من سددک ,2##411
369,5774,و قال ع کفاک ادبا لنفسک اجتناب ما تکرهه من غیرک ,2##412
370,5775,و قال ع من صبر صبر الاحرار و الا سلا سلو الاغمار ,2##413
371,5776,و فی خبر اخر انه ع قال للاشعث بن قیس معزیا عن ابن له ان صبرت صبر الاکارم و الا سلوت سلو البهائم ,2##414
372,5777,و قال ع فی صفه الدنیا تغر و تضر و تمر ان الله تعالی لم یرضها ثوابا لاولیائه و لا عقابا لاعدائه و ان اهل الدنیا کرکب بینا هم حلوا اذ صاح بهم سائقهم فارتحلوا ,2##415
373,5778,و قال ع الحلم عشیره ,2##418
374,5779,و قال ع مسکین ابن ادم مکتوم الاجل مکنون العلل محفوظ العمل تؤلمه البقه و تقتله الشرقه و تنتنه العرقه ,2##419
375,5780,و قال ع کفاک من عقلک ما اوضح لک سبل غیک من رشدک ,2##421
376,5781,و قال ع افعلوا الخیر و لا تحقروا منه شیئا فان صغیره کبیر و قلیله کثیر و لا یقولن احدکم ان احدا اولی بفعل الخیر منی فیکون و الله کذلک ان للخیر و الشر اهلا فمهما ترکتموه منهما کفاکموه اهله ,2##422
377,5782,و قال ع من اصلح سریرته اصلح الله علانیته و من عمل لدینه کفاه الله امر دنیاه و من احسن فیما بینه و بین الله احسن الله ما بینه و بین الناس ,2##423
378,5783,و قال ع الحلم غطاء ساتر و العقل حسام قاطع فاستر خلل خلقک بحلمک و قاتل هواک بعقلک ,2##424
379,5784,و قال ع ان لله عبادا یختصهم الله بالنعم لمنافع العباد فیقرها فی ایدیهم ما بذلوها فاذا منعوها نزعها منهم ثم حولها الی غیرهم ,2##425
380,5785,و قال ع لا ینبغی للعبد ان یثق بخصلتین العافیه و الغنی بینا تراه معافی اذ سقم و بینا تراه غنیا اذ افتقر ,2##426
381,5786,و قال ع من شکا الحاجه الی مؤمن فکانه شکاها الی الله و من شکاها الی کافر فکانما شکا الله ,2##427
382,5787,و قال ع فی بعض الاعیاد انما هو عید لمن قبل الله صیامه و شکر قیامه و کل یوم لا یعصی الله فیه فهو عید ,2##428
383,5788,و قال ع ان اعظم الحسرات یوم القیامه حسره رجل کسب مالا فی غیر طاعه الله فورثه رجل فانفقه فی طاعه الله سبحانه فدخل به الجنه و دخل الاول به النار ,2##429
384,5789,و قال ع ان اخسر الناس صفقه و اخیبهم سعیا رجل اخلق بدنه فی طلب ماله و لم تساعده المقادیر علی ارادته فخرج من الدنیا بحسرته و قدم علی الاخره بتبعته ,2##430
385,5790,و قال ع الرزق رزقان طالب و مطلوب فمن طلب الدنیا طلبه الموت حتی یخرجه عنها و من طلب الاخره طلبته الدنیا حتی یستوفی‌ رزقه منها ,2##431
386,5791,و قال ع اذکروا انقطاع اللذات و بقاء التبعات ,2##433
387,5792,و قال ع اخبر تقله ,2##434
388,5793,و قال ع ما کان الله لیفتح علی عبد باب الشکر و یغلق عنه باب الزیاده و لا لیفتح علی عبد باب الدعاء و یغلق عنه باب الاجابه و لا لیفتح لعبد باب التوبه و یغلق عنه باب المغفره ,2##435
389,5794,و قال ع اولی الناس بالکرم من عرفت به الکرام ,2##436
390,5795,و سئل ع ایهما افضل العدل او الجود فقال ع العدل یضع الامور مواضعها و الجود یخرجها من جهتها و العدل سائس عام و الجود عارض خاص فالعدل اشرفهما و افضلهما ,2##437
391,5796,و قال ع الناس اعداء ما جهلوا ,2##438
392,5797,و قال ع الزهد کله بین کلمتین من القران قال الله سبحانهلکیلا تاسوا علی ما فاتکم و لا تفرحوا بما اتاکم و من لم یاس علی الماضی و لم یفرح بالاتی فقد اخذ الزهد بطرفیه ,2##439
393,5798,و قال ع ما انقض النوم لعزائم الیوم ,2##440
394,5799,و قال ع الولایات مضامیر الرجال ,2##441
395,5800,و قال ع لیس بلد باحق بک من بلد خیر البلاد ما حملک ,2##442
396,5801,و قال ع و قد جاءه نعی‌ الاشتر رحمه الله مالک و ما مالک و الله لو کان جبلا لکان فندا و لو کان حجرا لکان صلدا لا یرتقیه الحافر و لا یوفی علیه الطائر ,2##443
397,5802,و قال ع قلیل مدوم علیه خیر من کثیر مملول منه ,2##444
398,5803,و قال ع اذا کان فی رجل خله رائقه فانتظروا اخواتها ,2##445
399,5804,و قال ع لغالب بن صعصعه ابی الفرزدق فی کلام دار بینهما ما فعلت ابلک الکثیره قال دغدغتها الحقوق یا امیر المؤمنین فقال ع ذلک احمد سبلها ,2##446
400,5805,و قال ع من اتجر بغیر فقه فقد ارتطم فی الربا ,2##447
401,5806,و قال ع من عظم صغار المصائب ابتلاه الله بکبارها ,2##448
402,5807,و قال ع من کرمت علیه نفسه هانت علیه شهواته ,2##449
403,5808,و قال ع ما مزح امرؤ مزحه الا مج من عقله مجه ,2##450
404,5809,و قال ع زهدک فی راغب فیک نقصان حظ و رغبتک فی زاهد فیک ذل نفس ,2##451
405,5810,و قال ع الغنی و الفقر بعد العرض علی الله ,2##452
406,5811,و قال ع ما زال الزبیر رجلا منا اهل البیت حتی نشا ابنه المشئوم عبد الله ,2##453
407,5812,و قال ع ما لابن ادم و الفخر اوله نطفه و اخره جیفه و لا یرزق نفسه و لا یدفع حتفه ,2##454
408,5813,و سئل من اشعر الشعراء فقال ع ان القوم لم یجروا فی حلبه تعرف الغایه عند قصبتها فان کان و لا بد فالملک الضلیل ,2##455
409,5814,و قال ع الا حر یدع هذه اللماظه لاهلها انه لیس لانفسکم ثمن الا الجنه فلا تبیعوها الا بها ,2##456
410,5815,و قال ع منهومان لا یشبعان طالب علم و طالب دنیا ,2##457
411,5816,و قال ع الایمان ان تؤثر الصدق حیث یضرک علی الکذب حیث ینفعک و الا یکون فی حدیثک فضل عن عملک و ان تتقی‌ الله فی حدیث غیرک ,2##458
412,5817,و قال ع یغلب المقدار علی التقدیر حتی تکون الافه فی التدبیر ,2##459
413,5818,و قال ع الحلم و الاناه توامان ینتجهما علو الهمه ,2##460
414,5819,و قال ع الغیبه جهد العاجز ,2##461
415,5820,و قال ع رب مفتون بحسن القول فیه ,2##462
416,5821,و قال ع الدنیا خلقت لغیرها و لم تخلق لنفسها ,2##463
417,5822,و قال ع ان لبنی امیه مرودا یجرون فیه و لو قد اختلفوا فیما بینهم ثم کادتهم الضباع لغلبتهم ,2##464
418,5823,و قال ع فی مدح الانصار هم و الله ربوا الاسلام کما یربی الفلو مع غنائهم بایدیهم السباط و السنتهم السلاط ,2##465
419,5824,و قال ع العین وکاء السه ,2##466
420,5825,و قال ع فی کلام له و ولیهم وال فاقام و استقام حتی ضرب الدین بجرانه ,2##467
421,5826,و قال ع یاتی علی الناس زمان عضوض یعض الموسر فیه علی ما فی یدیه و لم یؤمر بذلک قال الله سبحانهو لا تنسوا الفضل بینکمتنهد فیه الاشرار و تستذل الاخیار و یبایع المضطرون و قد نهی رسول اللهص عن بیع المضطرین ,2##468
422,5827,و قال ع یهلک فی رجلان محب مفرط و باهت مفتر هلک فی رجلان محب غال و مبغض قال ,2##469
423,5828,و سئل عن التوحید و العدل فقال ع التوحید الا تتوهمه و العدل الا تتهمه ,2##470
424,5829,و قال ع لا خیر فی الصمت عن الحکم کما انه لا خیر فی القول بالجهل ,2##471
425,5830,و قال ع فی دعاء استسقی به اللهم اسقنا ذلل السحاب دون صعابها ,2##472
426,5831,و قیل له ع لو غیرت شیبک یا امیر المؤمنین فقال ع الخضاب زینه و نحن قوم فی مصیبه یرید وفاه رسول اللهص ,2##473
427,5832,و قال ع ما المجاهد الشهید فی سبیل الله باعظم اجرا ممن قدر فعف لکاد العفیف ان یکون ملکا من الملائکه ,2##474
428,5833,و قال ع القناعه مال لا ینفد ,2##475
429,5834,و قال ع لزیاد ابن ابیه و قد استخلفه لعبد الله بن العباس علی فارس و اعمالها فی کلام طویل کان بینهما نهاه فیه عن تقدم الخراج.استعمل العدل و احذر العسف و الحیف فان العسف یعود بالجلاء و الحیف یدعو الی السیف ,2##476
430,5835,و قال ع اشد الذنوب ما استخف بها صاحبه ,2##477
431,5836,و قال ع ما اخذ الله علی اهل الجهل ان یتعلموا حتی اخذ علی اهل العلم ان یعلموا ,2##478
432,5837,و قال ع شر الاخوان من تکلف له ,2##479
433,5838,و قال ع اذا احتشم المؤمن اخاه فقد فارقه,2##480
